index,name,isin,url
800,CT Managed Bond Focused Z Inc GBP,GB00BMGRVQ12,https://investorhub.financialexpress.net/Pdf/fdd/en-gb/fdd/UYWN/U/?specialunittype=ORDN&priipproductcode=
805,CT Managed Equity Focused Inst Acc GBP,GB00BMGRW139,https://investorhub.financialexpress.net/Pdf/fdd/en-gb/fdd/W6VA/U/?specialunittype=ORDN&priipproductcode=
810,CT Managed Growth C Acc,GB00BYZ62Y83,https://investorhub.financialexpress.net/Pdf/fdd/en-gb/fdd/MVJQ/U/?specialunittype=ORDN&priipproductcode=
815,CT Monthly Extra Income ZNA GBP,GB00BP8S6244,https://investorhub.financialexpress.net/Pdf/fdd/en-gb/fdd/KOTH/U/?specialunittype=ORDN&priipproductcode=
820,CT Multi-Manager Universal Balanced B Inc,GB00B4YRCK80,https://investorhub.financialexpress.net/Pdf/fdd/en-gb/fdd/FMI1/U/?specialunittype=ORDN&priipproductcode=
825,CT Multi-Manager Universal Growth B Acc,GB00B7S6RS52,https://investorhub.financialexpress.net/Pdf/fdd/en-gb/fdd/GRGS/U/?specialunittype=ORDN&priipproductcode=
830,CT Property Growth & Income I Acc,GB00BQWJ8687,https://investorhub.financialexpress.net/Pdf/fdd/en-gb/fdd/M3IJ/U/?specialunittype=ORDN&priipproductcode=
835,CT Responsible Sterling Corporate Bond 2 Inc,GB00B23YHV29,https://investorhub.financialexpress.net/Pdf/fdd/en-gb/fdd/A6B3/U/?specialunittype=ORDN&priipproductcode=
840,CT Responsible UK Income 2 Inc,GB0033144857,https://investorhub.financialexpress.net/Pdf/fdd/en-gb/fdd/IO47/U/?specialunittype=ORDN&priipproductcode=
845,CT Sterling Bond ZNI GBP,GB00B7SH5738,https://investorhub.financialexpress.net/Pdf/fdd/en-gb/fdd/G7DO/U/?specialunittype=ORDN&priipproductcode=
850,CT Strategic Bond ZNI GBP,GB00B882QB67,https://investorhub.financialexpress.net/Pdf/fdd/en-gb/fdd/GDYS/U/?specialunittype=ORDN&priipproductcode=
855,CT Sustainable Universal MAP Cautious C Acc GBP,GB00BKV44647,https://investorhub.financialexpress.net/Pdf/fdd/en-gb/fdd/QQQ6/U/?specialunittype=ORDN&priipproductcode=
860,CT UK Equity Alpha Income ZNI GBP,,https://investorhub.financialexpress.net/Pdf/fdd/en-gb/fdd/G7CW/U/?specialunittype=ORDN&priipproductcode=
865,CT UK Mid 250 ZNA GBP,GB00B8BX5X11,https://investorhub.financialexpress.net/Pdf/fdd/en-gb/fdd/G7CZ/U/?specialunittype=ORDN&priipproductcode=
870,CT UK Social Bond ZNI GBP,GB00BF233915,https://investorhub.financialexpress.net/Pdf/fdd/en-gb/fdd/JTYT/U/?specialunittype=ORDN&priipproductcode=
875,CT Universal MAP Adventurous C Acc,GB00BK5Z9G83,https://investorhub.financialexpress.net/Pdf/fdd/en-gb/fdd/QLEH/U/?specialunittype=ORDN&priipproductcode=
880,CT Universal MAP Income C Acc,GB00BK5ZC697,https://investorhub.financialexpress.net/Pdf/fdd/en-gb/fdd/QLEM/U/?specialunittype=ORDN&priipproductcode=
885,Discovery Balanced C Acc GBP,GB00BYN66598,https://investorhub.financialexpress.net/Pdf/fdd/en-gb/fdd/MYHV/U/?specialunittype=ORDN&priipproductcode=
890,Dodge & Cox Global Bond Fund Dis GBP,IE00B556C015,https://investorhub.financialexpress.net/Pdf/fdd/en-gb/fdd/KG1A/O/?specialunittype=ORDN&priipproductcode=
895,EdenTree Global Impact Bond B,GB00BP5FBJ01,https://investorhub.financialexpress.net/Pdf/fdd/en-gb/fdd/VRTD/U/?specialunittype=ORDN&priipproductcode=
900,EdenTree Sustainable Managed Income B Dis GBP,GB0009449710,https://investorhub.financialexpress.net/Pdf/fdd/en-gb/fdd/A195/U/?specialunittype=ORDN&priipproductcode=
905,EF WM Global Corporate Autonomies I Acc,GB00BV0LRZ32,https://investorhub.financialexpress.net/Pdf/fdd/en-gb/fdd/BN2I/U/?specialunittype=ORDN&priipproductcode=
910,EPIC Wealth R Acc GBP,IE00BMHMYT98,https://investorhub.financialexpress.net/Pdf/fdd/en-gb/fdd/LLAG/DC/?specialunittype=ORDN&priipproductcode=
915,Evelyn Balanced Portfolio Clean Dist GBP,IE00BFY1NJ32,https://investorhub.financialexpress.net/Pdf/fdd/en-gb/fdd/QGPM/DC/?specialunittype=ORDN&priipproductcode=
920,Evelyn Defensive Portfolio Clean Acc,IE00BYX8KL94,https://investorhub.financialexpress.net/Pdf/fdd/en-gb/fdd/NQ9U/DC/?specialunittype=ORDN&priipproductcode=
925,Evelyn Growth Portfolio Clean Inc,IE00BYX8KS63,https://investorhub.financialexpress.net/Pdf/fdd/en-gb/fdd/NQ9Z/DC/?specialunittype=ORDN&priipproductcode=
930,Evelyn Income Portfolio Institutional Acc GBP,IE00BFY1MV86,https://investorhub.financialexpress.net/Pdf/fdd/en-gb/fdd/QGQE/DC/?specialunittype=ORDN&priipproductcode=
935,Evelyn MM Global Investment B Inc,GB00B89C3K35,https://investorhub.financialexpress.net/Pdf/fdd/en-gb/fdd/GM3A/U/?specialunittype=ORDN&priipproductcode=
940,Federated Hermes MDT US Equity F Acc GBP,IE000W000344,https://investorhub.financialexpress.net/Pdf/fdd/en-gb/fdd/BUMA4/O/?specialunittype=ORDN&priipproductcode=
945,Federated Hermes US SMID Equity F Dis GBP,IE00B8493D29,https://investorhub.financialexpress.net/Pdf/fdd/en-gb/fdd/GSAG/O/?specialunittype=ORDN&priipproductcode=
950,Fidelity America W GBP,LU1033662245,https://investorhub.financialexpress.net/Pdf/fdd/en-gb/fdd/K5LG/DC/?specialunittype=ORDN&priipproductcode=
955,Fidelity Asia W Acc,GB00B6Y7NF43,https://investorhub.financialexpress.net/Pdf/fdd/en-gb/fdd/GMUE/U/?specialunittype=ORDN&priipproductcode=
960,Fidelity Asian Special Situations W Inc GBP,LU1235295968,https://investorhub.financialexpress.net/Pdf/fdd/en-gb/fdd/FUWG/O/?specialunittype=ORDN&priipproductcode=
965,Fidelity China W Acc,GB00B82ZSC67,https://investorhub.financialexpress.net/Pdf/fdd/en-gb/fdd/GMTP/U/?specialunittype=ORDN&priipproductcode=
970,Fidelity Emerging Markets W Acc GBP,LU1033662674,https://investorhub.financialexpress.net/Pdf/fdd/en-gb/fdd/K5LJ/DC/?specialunittype=ORDN&priipproductcode=
975,Fidelity Euro 50 Index A GBP,LU0112642557,https://investorhub.financialexpress.net/Pdf/fdd/en-gb/fdd/FE79/DC/?specialunittype=ORDN&priipproductcode=
980,Fidelity Flexible Bond Y GBP,LU0896308789,https://investorhub.financialexpress.net/Pdf/fdd/en-gb/fdd/F7EX/DC/?specialunittype=ORDN&priipproductcode=
985,Fidelity Global Dividend W Acc,GB00B7GJPN73,https://investorhub.financialexpress.net/Pdf/fdd/en-gb/fdd/GMTX/U/?specialunittype=ORDN&priipproductcode=
990,Fidelity Global Enhanced Income W Acc,GB00BD1NLL62,https://investorhub.financialexpress.net/Pdf/fdd/en-gb/fdd/JQ7L/U/?specialunittype=ORDN&priipproductcode=
995,Fidelity Global Future Leaders W Acc GBP,GB00BPLVMC21,https://investorhub.financialexpress.net/Pdf/fdd/en-gb/fdd/AXLCA/U/?specialunittype=ORDN&priipproductcode=
1000,Fidelity Global Inflation Linked Bond Y Hedged GBP,LU0393653919,https://investorhub.financialexpress.net/Pdf/fdd/en-gb/fdd/E4I8/O/?specialunittype=CHDG&priipproductcode=
1005,Fidelity Index Emerging Markets P Inc,GB00BP8RYT47,https://investorhub.financialexpress.net/Pdf/fdd/en-gb/fdd/KOHB/U/?specialunittype=ORDN&priipproductcode=
1010,Fidelity Index Pacific ex Japan P Acc,GB00BHZK8G51,https://investorhub.financialexpress.net/Pdf/fdd/en-gb/fdd/K38Y/U/?specialunittype=ORDN&priipproductcode=
1015,Fidelity Index UK P Inc,GB00BP8RY614,https://investorhub.financialexpress.net/Pdf/fdd/en-gb/fdd/KOGP/U/?specialunittype=ORDN&priipproductcode=
1020,Fidelity Index US P Inc,GB00BP8RY838,https://investorhub.financialexpress.net/Pdf/fdd/en-gb/fdd/KOGR/U/?specialunittype=ORDN&priipproductcode=
1025,Fidelity Japan W Acc,GB00B882N041,https://investorhub.financialexpress.net/Pdf/fdd/en-gb/fdd/GMUJ/U/?specialunittype=ORDN&priipproductcode=
1030,Fidelity MoneyBuilder Corporate Bond W Dis GBP,GB00B3Z9PT62,https://investorhub.financialexpress.net/Pdf/fdd/en-gb/fdd/GQM7/U/?specialunittype=ORDN&priipproductcode=
1035,Fidelity Multi Asset Allocator Growth W Acc,GB00B9C3GS90,https://investorhub.financialexpress.net/Pdf/fdd/en-gb/fdd/0DT3/U/?specialunittype=ORDN&priipproductcode=
1040,Fidelity Multi Asset Income & Growth W Inc,GB00BFPC0C71,https://investorhub.financialexpress.net/Pdf/fdd/en-gb/fdd/JSQV/U/?specialunittype=ORDN&priipproductcode=
1045,Fidelity Multi Asset Open Growth W Acc,GB00BC7GXL63,https://investorhub.financialexpress.net/Pdf/fdd/en-gb/fdd/JJFY/U/?specialunittype=ORDN&priipproductcode=
1050,Fidelity Responsible Asia Equity W Acc,GB00B84Q8M70,https://investorhub.financialexpress.net/Pdf/fdd/en-gb/fdd/GMTT/U/?specialunittype=ORDN&priipproductcode=
1055,Fidelity Short Dated Corporate Bond W Inc,GB00BDCG0F15,https://investorhub.financialexpress.net/Pdf/fdd/en-gb/fdd/NGNY/U/?specialunittype=ORDN&priipproductcode=
1060,Fidelity Sustainable European Equity W Acc,GB00B8287518,https://investorhub.financialexpress.net/Pdf/fdd/en-gb/fdd/GMTU/U/?specialunittype=ORDN&priipproductcode=
1065,Fidelity UK Equity Income W Inc GBP,GB00B3LNGT95,https://investorhub.financialexpress.net/Pdf/fdd/en-gb/fdd/0VNB/U/?specialunittype=ORDN&priipproductcode=
1070,Fidelity UK Smaller Companies W Acc,GB00B7VNMB18,https://investorhub.financialexpress.net/Pdf/fdd/en-gb/fdd/GMUG/U/?specialunittype=ORDN&priipproductcode=
1075,Fidelity US High Yield W GBP,LU1033664530,https://investorhub.financialexpress.net/Pdf/fdd/en-gb/fdd/K5LZ/DC/?specialunittype=ORDN&priipproductcode=
1080,First Sentier Global Listed Infrastructure B Inc GBP,GB00B24HK556,https://investorhub.financialexpress.net/Pdf/fdd/en-gb/fdd/A6X4/U/?specialunittype=ORDN&priipproductcode=
1085,Fortem Capital Progressive Growth A GBP,IE00BF047831,https://investorhub.financialexpress.net/Pdf/fdd/en-gb/fdd/OF5G/O/?specialunittype=ORDN&priipproductcode=
1090,FP Apollo Multi Asset Cautious F GBP,GB00B4TDQD29,https://investorhub.financialexpress.net/Pdf/fdd/en-gb/fdd/GYT3/U/?specialunittype=ORDN&priipproductcode=
1095,FP Carmignac Global Equity Compounders A Acc GBP,GB00BMGLBK75,https://investorhub.financialexpress.net/Pdf/fdd/en-gb/fdd/R22O/U/?specialunittype=ORDN&priipproductcode=
1100,FP Foresight Sustainable Real Estate Securities A Acc GBP,GB00BMFYBB80,https://investorhub.financialexpress.net/Pdf/fdd/en-gb/fdd/R3EW/U/?specialunittype=ORDN&priipproductcode=
1105,FP Octopus UK Micro Cap Growth P Acc,GB00BYQ7HN43,https://investorhub.financialexpress.net/Pdf/fdd/en-gb/fdd/NFZH/U/?specialunittype=ORDN&priipproductcode=
1110,FP Russell Investments International Growth Assets C Acc,GB00B4KHXP47,https://investorhub.financialexpress.net/Pdf/fdd/en-gb/fdd/HZP6/U/?specialunittype=ORDN&priipproductcode=
1115,FP Russell Investments Multi Asset Growth II C Inc,GB00BYXJKP60,https://investorhub.financialexpress.net/Pdf/fdd/en-gb/fdd/MU6E/U/?specialunittype=ORDN&priipproductcode=
1120,FP Russell Investments Multi Asset Growth V C Acc,GB00BYXJKV21,https://investorhub.financialexpress.net/Pdf/fdd/en-gb/fdd/MU6J/U/?specialunittype=ORDN&priipproductcode=
1125,FP Russell Investments UK Growth Assets C Inc,,https://investorhub.financialexpress.net/Pdf/fdd/en-gb/fdd/HZO9/U/?specialunittype=ORDN&priipproductcode=
1130,Franklin Sustainable Global Growth W Acc GBP,LU0768359183,https://investorhub.financialexpress.net/Pdf/fdd/en-gb/fdd/G26U/DC/?specialunittype=ORDN&priipproductcode=
1135,FSSA Global Emerging Markets Focus B Acc GBP,GB00BZCCYG25,https://investorhub.financialexpress.net/Pdf/fdd/en-gb/fdd/NOOE/U/?specialunittype=ORDN&priipproductcode=
1140,FTF Brandywine Global Income Optimiser W Inc,GB00BNBS7S01,https://investorhub.financialexpress.net/Pdf/fdd/en-gb/fdd/V2Y9/U/?specialunittype=ORDN&priipproductcode=
1145,FTF ClearBridge UK Equity Income W Acc,GB00B7DRD638,https://investorhub.financialexpress.net/Pdf/fdd/en-gb/fdd/G25P/U/?specialunittype=ORDN&priipproductcode=
1150,FTF ClearBridge UK Mid Cap W Inc,GB00B8K8HH50,https://investorhub.financialexpress.net/Pdf/fdd/en-gb/fdd/GRYE/U/?specialunittype=ORDN&priipproductcode=
1155,FTF ClearBridge US Equity Income W Acc,GB00BMF4SY06,https://investorhub.financialexpress.net/Pdf/fdd/en-gb/fdd/XW7N/U/?specialunittype=ORDN&priipproductcode=
1160,FTF Franklin Global Unconstrained W Acc,GB00BP9LKD12,https://investorhub.financialexpress.net/Pdf/fdd/en-gb/fdd/ZQ0J/U/?specialunittype=ORDN&priipproductcode=
1165,FTF Templeton Global Emerging Markets W Acc,GB00B7MZ0J00,https://investorhub.financialexpress.net/Pdf/fdd/en-gb/fdd/G26B/U/?specialunittype=ORDN&priipproductcode=
1170,FTGF Brandywine Global Fixed Income Absolute Return X M Hedged Dis GBP,IE00B7VSFK60,https://investorhub.financialexpress.net/Pdf/fdd/en-gb/fdd/MP9E/DC/?specialunittype=CHDG&priipproductcode=
1175,FTGF ClearBridge US Equity Sustainability Leaders X Acc GBP,IE00BZ1NPT63,https://investorhub.financialexpress.net/Pdf/fdd/en-gb/fdd/E46A/O/?specialunittype=ORDN&priipproductcode=
1180,Fundsmith Equity I Inc,GB00B4MR8G82,https://investorhub.financialexpress.net/Pdf/fdd/en-gb/fdd/LSX5/U/?specialunittype=ORDN&priipproductcode=
1185,GAM GAM Star Private Equity LiquidRep Inst Inc GBP,IE00B5TJG591,https://investorhub.financialexpress.net/Pdf/fdd/en-gb/fdd/M5RG/O/?specialunittype=ORDN&priipproductcode=
1190,GAM Star Credit Opportunities GBP Inst,IE00B510J173,https://investorhub.financialexpress.net/Pdf/fdd/en-gb/fdd/I9LX/O/?specialunittype=ORDN&priipproductcode=
1195,GAM Star Disruptive Growth Institutional Inc GBP,IE00B57FYK02,https://investorhub.financialexpress.net/Pdf/fdd/en-gb/fdd/05ZQ/O/?specialunittype=ORDN&priipproductcode=
1200,GAM Star Global Flexible Inst Hdg GBP,IE00B56X5F76,https://investorhub.financialexpress.net/Pdf/fdd/en-gb/fdd/GTVA/O/?specialunittype=CHDG&priipproductcode=
1205,GAM Star Global Rates Inst Acc GBP,IE00B59CJW65,https://investorhub.financialexpress.net/Pdf/fdd/en-gb/fdd/HTP0/O/?specialunittype=CHDG&priipproductcode=
1210,GS Asia High Yield Bond Portfolio R GBP,LU2250369423,https://investorhub.financialexpress.net/Pdf/fdd/en-gb/fdd/TDXW/O/?specialunittype=ORDN&priipproductcode=
1215,GS Emerging Markets Equity Portfolio R GBP,LU0858288516,https://investorhub.financialexpress.net/Pdf/fdd/en-gb/fdd/F4NM/O/?specialunittype=ORDN&priipproductcode=
1220,GS Global Future Generations Equity Portfolio R Acc GBP,LU1341142310,https://investorhub.financialexpress.net/Pdf/fdd/en-gb/fdd/E5DT/O/?specialunittype=ORDN&priipproductcode=
1225,GS Global Multi-Asset Balanced Portfolio R (GBP Partially-Hedged),LU1057462530,https://investorhub.financialexpress.net/Pdf/fdd/en-gb/fdd/FL6R/O/?specialunittype=CHDG&priipproductcode=
1230,GS Goldman Sachs Europe CORE® Equity Portfolio R GBP,LU0858292385,https://investorhub.financialexpress.net/Pdf/fdd/en-gb/fdd/F4IC/O/?specialunittype=ORDN&priipproductcode=
1235,GS Green Bond R Acc GBP,LU2216213103,https://investorhub.financialexpress.net/Pdf/fdd/en-gb/fdd/DPVE/DC/?specialunittype=ORDN&priipproductcode=
1240,GS Short Duration Opportunistic Corporate Bond Portfolio R Hedged GBP,LU0858301129,https://investorhub.financialexpress.net/Pdf/fdd/en-gb/fdd/F4IN/O/?specialunittype=CHDG&priipproductcode=
1245,Guinness Best of Asia Y Acc GBP,IE00BF2VFY44,https://investorhub.financialexpress.net/Pdf/fdd/en-gb/fdd/ODIW/O/?specialunittype=ORDN&priipproductcode=
1250,Guinness European Equity Income Y Dis GBP,IE00BYVHWJ06,https://investorhub.financialexpress.net/Pdf/fdd/en-gb/fdd/ODXL/O/?specialunittype=ORDN&priipproductcode=
1255,Guinness Global Money Managers Y Acc GBP,IE00B7MJHM43,https://investorhub.financialexpress.net/Pdf/fdd/en-gb/fdd/0VNP/O/?specialunittype=ORDN&priipproductcode=
1260,Heriot Global A Inc,GB00B835GN22,https://investorhub.financialexpress.net/Pdf/fdd/en-gb/fdd/ICHC/U/?specialunittype=ORDN&priipproductcode=
1265,HSBC Corporate Bond C Acc,GB00B85KC152,https://investorhub.financialexpress.net/Pdf/fdd/en-gb/fdd/GTNE/U/?specialunittype=ORDN&priipproductcode=
1270,HSBC Europe Ex-UK Equity C Inc,GB00BNYFWC75,https://investorhub.financialexpress.net/Pdf/fdd/en-gb/fdd/T8OO/U/?specialunittype=ORDN&priipproductcode=
1275,HSBC FTSE 250 Index C Acc,GB00B80QG052,https://investorhub.financialexpress.net/Pdf/fdd/en-gb/fdd/G18Y/U/?specialunittype=ORDN&priipproductcode=
1280,HSBC FTSE All World Index IC Inc,GB00BMJJJG09,https://investorhub.financialexpress.net/Pdf/fdd/en-gb/fdd/KLDP/U/?specialunittype=ORDN&priipproductcode=
1285,HSBC Global Responsible Multi-Asset Balanced Portfolio C Inc,GB00BF1H4D51,https://investorhub.financialexpress.net/Pdf/fdd/en-gb/fdd/PJT5/U/?specialunittype=ORDN&priipproductcode=
1290,HSBC Global Strategy Adventurous Portfolio C Inc,GB00BYVXBG82,https://investorhub.financialexpress.net/Pdf/fdd/en-gb/fdd/O2QE/U/?specialunittype=ORDN&priipproductcode=
1295,HSBC Global Strategy Conservative Portfolio C Acc,GB00BYVXBK29,https://investorhub.financialexpress.net/Pdf/fdd/en-gb/fdd/O2QB/U/?specialunittype=ORDN&priipproductcode=
1300,HSBC Income C Inc,GB00B80L0G42,https://investorhub.financialexpress.net/Pdf/fdd/en-gb/fdd/GTNK/U/?specialunittype=ORDN&priipproductcode=
1305,HSBC Multi Factor Worldwide Equity BD Dis GBP,IE0001UT0D36,https://investorhub.financialexpress.net/Pdf/fdd/en-gb/fdd/WWJE/DC/?specialunittype=ORDN&priipproductcode=
1310,HSBC Sterling Corporate Bond Index C Acc,GB00BYV9WC94,https://investorhub.financialexpress.net/Pdf/fdd/en-gb/fdd/N8FY/U/?specialunittype=ORDN&priipproductcode=
1315,HSBC UK Growth & Income C Inc,GB00B86PKV52,https://investorhub.financialexpress.net/Pdf/fdd/en-gb/fdd/GTNO/U/?specialunittype=ORDN&priipproductcode=
1320,HSBC World Selection Adventurous Portfolio IC Inc,GB00BQ15ZR72,https://investorhub.financialexpress.net/Pdf/fdd/en-gb/fdd/KX5O/U/?specialunittype=ORDN&priipproductcode=
1325,HSBC World Selection Conservative Portfolio C Acc,GB00BQ15ZM28,https://investorhub.financialexpress.net/Pdf/fdd/en-gb/fdd/KX5J/U/?specialunittype=ORDN&priipproductcode=
1330,HSBC World Selection Interest Income Portfolio C Inc,GB00B7KHQP68,https://investorhub.financialexpress.net/Pdf/fdd/en-gb/fdd/GTMX/U/?specialunittype=ORDN&priipproductcode=
1335,IFSL Ascot Lloyd 4 A Inc,GB00BJXFL120,https://investorhub.financialexpress.net/Pdf/fdd/en-gb/fdd/Q6L4/U/?specialunittype=ORDN&priipproductcode=
1340,IFSL Ascot Lloyd 7 A Acc,GB00BJXFRQ99,https://investorhub.financialexpress.net/Pdf/fdd/en-gb/fdd/Q6LL/U/?specialunittype=ORDN&priipproductcode=
1345,IFSL atomos Balanced A Inc,GB00BHZ0CZ21,https://investorhub.financialexpress.net/Pdf/fdd/en-gb/fdd/PYGQ/U/?specialunittype=ORDN&priipproductcode=
1350,IFSL atomos Defensive A Acc,GB00BK8VGD91,https://investorhub.financialexpress.net/Pdf/fdd/en-gb/fdd/QNKA/U/?specialunittype=ORDN&priipproductcode=
1355,IFSL Church House Investment Grade Fixed Interest Inc,GB0004743828,https://investorhub.financialexpress.net/Pdf/fdd/en-gb/fdd/LF26/U/?specialunittype=ORDN&priipproductcode=
1360,IFSL Church House UK Equity Growth B Acc,GB00BNBNR962,https://investorhub.financialexpress.net/Pdf/fdd/en-gb/fdd/KKNZ/U/?specialunittype=ORDN&priipproductcode=
1365,IFSL Evenlode Income B Inc,GB00BD0B7D55,https://investorhub.financialexpress.net/Pdf/fdd/en-gb/fdd/G6C8/U/?specialunittype=ORDN&priipproductcode=
1370,IFSL Marlborough 4 Portfolio P Inc,GB00B8T2QP98,https://investorhub.financialexpress.net/Pdf/fdd/en-gb/fdd/I3OI/U/?specialunittype=ORDN&priipproductcode=
1375,IFSL Marlborough Far East Growth P Acc,GB00B8N9CJ23,https://investorhub.financialexpress.net/Pdf/fdd/en-gb/fdd/I3OT/U/?specialunittype=ORDN&priipproductcode=
1380,IFSL Marlborough Global High Yield Bond P Inc,GB00B8L7D393,https://investorhub.financialexpress.net/Pdf/fdd/en-gb/fdd/I3PB/U/?specialunittype=ORDN&priipproductcode=
1385,IFSL Marlborough Nano-Cap Growth P Acc,GB00BF2ZV048,https://investorhub.financialexpress.net/Pdf/fdd/en-gb/fdd/JTBI/U/?specialunittype=ORDN&priipproductcode=
1390,IFSL Meon Adaptive Growth P Inc,GB00BMQ8V644,https://investorhub.financialexpress.net/Pdf/fdd/en-gb/fdd/WLWM/U/?specialunittype=ORDN&priipproductcode=
1395,IFSL Rockhold Global Equity A Acc,GB00BNM3D752,https://investorhub.financialexpress.net/Pdf/fdd/en-gb/fdd/UQFJ/U/?specialunittype=ORDN&priipproductcode=
1400,IFSL Wise Multi-Asset Income B Inc,GB00B0LJ0160,https://investorhub.financialexpress.net/Pdf/fdd/en-gb/fdd/TJ63/U/?specialunittype=ORDN&priipproductcode=
1405,IMGP Sirios Absolute Return R D HP Dis GBP,LU2709242635,https://investorhub.financialexpress.net/Pdf/fdd/en-gb/fdd/AYR4M/O/?specialunittype=ORDN&priipproductcode=
1410,Impax Environmental Markets X Acc GBP,IE00BYQNSD98,https://investorhub.financialexpress.net/Pdf/fdd/en-gb/fdd/N00Z/O/?specialunittype=ORDN&priipproductcode=
1415,Invesco Corporate Bond (UK) Z Inc,GB00B8N45097,https://investorhub.financialexpress.net/Pdf/fdd/en-gb/fdd/GUVR/U/?specialunittype=ORDN&priipproductcode=
1420,Invesco European Equity (UK) Z Acc,GB00B8N44J10,https://investorhub.financialexpress.net/Pdf/fdd/en-gb/fdd/GUVA/U/?specialunittype=ORDN&priipproductcode=
1425,Invesco European Focus (UK) Z Inc,GB00B8N44P79,https://investorhub.financialexpress.net/Pdf/fdd/en-gb/fdd/GUVF/U/?specialunittype=ORDN&priipproductcode=
1430,Invesco Global Emerging Markets (UK) Z Acc,GB00B8N46731,https://investorhub.financialexpress.net/Pdf/fdd/en-gb/fdd/GUXP/U/?specialunittype=ORDN&priipproductcode=
1435,Invesco Global Equity Income (UK) Z Inc,GB00B8N46178,https://investorhub.financialexpress.net/Pdf/fdd/en-gb/fdd/GUXJ/U/?specialunittype=ORDN&priipproductcode=
1440,Invesco Global Financial Capital (UK) Z Inc,GB00B8N45L07,https://investorhub.financialexpress.net/Pdf/fdd/en-gb/fdd/GUWR/U/?specialunittype=ORDN&priipproductcode=
1445,Invesco Global Smaller Companies (UK) Z Inc,GB00B8N46F12,https://investorhub.financialexpress.net/Pdf/fdd/en-gb/fdd/GUXV/U/?specialunittype=ORDN&priipproductcode=
1450,Invesco Japanese Equity Advantage (UK) Z Acc,GB00B8N44W47,https://investorhub.financialexpress.net/Pdf/fdd/en-gb/fdd/GUVL/U/?specialunittype=ORDN&priipproductcode=
1455,Invesco Managed Income (UK) Z Inc,GB00B8N46624,https://investorhub.financialexpress.net/Pdf/fdd/en-gb/fdd/GUXO/U/?specialunittype=ORDN&priipproductcode=
1460,Invesco Summit Growth 1 (UK) Z Acc,GB00BYZHL112,https://investorhub.financialexpress.net/Pdf/fdd/en-gb/fdd/OPXK/U/?specialunittype=ORDN&priipproductcode=
1465,Invesco Summit Income (UK) Z Inc GBP,GB00BP9QDL57,https://investorhub.financialexpress.net/Pdf/fdd/en-gb/fdd/AHY4J/U/?specialunittype=ORDN&priipproductcode=
1470,Invesco UK Equity High Income (UK) Z Acc,GB00B8N46L71,https://investorhub.financialexpress.net/Pdf/fdd/en-gb/fdd/GUYA/U/?specialunittype=ORDN&priipproductcode=
1475,Invesco UK Opportunities (UK) Z Inc,GB00B8N46T57,https://investorhub.financialexpress.net/Pdf/fdd/en-gb/fdd/GUYH/U/?specialunittype=ORDN&priipproductcode=
1480,iShares Continental European Equity ESG Screened and Optimised Index (UK) D Acc GBP,GB00BN08ZZ41,https://investorhub.financialexpress.net/Pdf/fdd/en-gb/fdd/LWKR/U/?specialunittype=ORDN&priipproductcode=
1485,iShares Emerging Markets Equity ESG Screened and Optimised Index (UK) D Acc,GB00BN090307,https://investorhub.financialexpress.net/Pdf/fdd/en-gb/fdd/W5UJ/U/?specialunittype=ORDN&priipproductcode=
1490,iShares Environment & Low Carbon Tilt Real Estate Index D Inc,GB00B848DD97,https://investorhub.financialexpress.net/Pdf/fdd/en-gb/fdd/GU0P/U/?specialunittype=ORDN&priipproductcode=
1495,iShares Index Linked Gilt Index (UK) D Acc,GB00B83RVT96,https://investorhub.financialexpress.net/Pdf/fdd/en-gb/fdd/G6VD/U/?specialunittype=ORDN&priipproductcode=
1500,iShares Mid Cap UK Equity Index (UK) D Acc,GB00B7VT0938,https://investorhub.financialexpress.net/Pdf/fdd/en-gb/fdd/G6VJ/U/?specialunittype=ORDN&priipproductcode=
1505,iShares Over 15 Years Gilts Index (UK) D Acc GBP,GB00BF338G29,https://investorhub.financialexpress.net/Pdf/fdd/en-gb/fdd/NUC0/U/?specialunittype=ORDN&priipproductcode=
1510,iShares UK Equity ESG Screened and Optimised Index (UK) D Inc GBP,GB00BN08ZW10,https://investorhub.financialexpress.net/Pdf/fdd/en-gb/fdd/D5LY/U/?specialunittype=ORDN&priipproductcode=
1515,iShares US Equity ESG Screened and Optimised Index (UK) D Acc GBP,GB00BN090C90,https://investorhub.financialexpress.net/Pdf/fdd/en-gb/fdd/DC9O/U/?specialunittype=ORDN&priipproductcode=
1520,Janus Henderson All Stocks Credit I Inc,GB0007451965,https://investorhub.financialexpress.net/Pdf/fdd/en-gb/fdd/HE65/U/?specialunittype=ORDN&priipproductcode=
1525,Janus Henderson Cautious Managed I Inc,GB00B4P4R697,https://investorhub.financialexpress.net/Pdf/fdd/en-gb/fdd/0Z9Q/U/?specialunittype=ORDN&priipproductcode=
1530,Janus Henderson Core 4 Income I Inc,GB00B94Q8L39,https://investorhub.financialexpress.net/Pdf/fdd/en-gb/fdd/J6LB/U/?specialunittype=ORDN&priipproductcode=
1535,Janus Henderson Diversified Alternatives I Acc,GB00BDZT6269,https://investorhub.financialexpress.net/Pdf/fdd/en-gb/fdd/PT9S/U/?specialunittype=ORDN&priipproductcode=
1540,Janus Henderson European Absolute Return I Acc,GB00B3CPX375,https://investorhub.financialexpress.net/Pdf/fdd/en-gb/fdd/DDO3/U/?specialunittype=ORDN&priipproductcode=
1545,Janus Henderson European Smaller Companies I Acc,GB0007476426,https://investorhub.financialexpress.net/Pdf/fdd/en-gb/fdd/TU07/U/?specialunittype=ORDN&priipproductcode=
1550,Janus Henderson Global Equity Income I Inc,GB0031263899,https://investorhub.financialexpress.net/Pdf/fdd/en-gb/fdd/NL19/U/?specialunittype=ORDN&priipproductcode=
1555,Janus Henderson Global Responsible Managed I Acc,GB00B4LMJ388,https://investorhub.financialexpress.net/Pdf/fdd/en-gb/fdd/KLW5/U/?specialunittype=ORDN&priipproductcode=
1560,Janus Henderson Global Sustainable Equity I Acc,GB00B71DPP64,https://investorhub.financialexpress.net/Pdf/fdd/en-gb/fdd/0Z9T/U/?specialunittype=ORDN&priipproductcode=
1565,Janus Henderson Inst Japan Index Opportunities I Acc,GB00B0LZBB16,https://investorhub.financialexpress.net/Pdf/fdd/en-gb/fdd/H371/U/?specialunittype=ORDN&priipproductcode=
1570,Janus Henderson Inst UK Index Opportunities Trust I Acc,GB00B02ZBX27,https://investorhub.financialexpress.net/Pdf/fdd/en-gb/fdd/HW74/U/?specialunittype=ORDN&priipproductcode=
1575,Janus Henderson Multi-Manager Diversified I Acc,GB00BHB1YY26,https://investorhub.financialexpress.net/Pdf/fdd/en-gb/fdd/K1YH/U/?specialunittype=ORDN&priipproductcode=
1580,Janus Henderson Multi-Manager Managed I Acc,GB00B7JZZK97,https://investorhub.financialexpress.net/Pdf/fdd/en-gb/fdd/G5KO/U/?specialunittype=ORDN&priipproductcode=
