index,name,isin,url
2380,Morgan Stanley Global Brands Equity Income I Acc GBP,GB00BZ4CG420,https://investorhub.financialexpress.net/Pdf/fdd/en-gb/fdd/NE3L/U/?specialunittype=ORDN&priipproductcode=
2385,Morgan Stanley Global Brands Inst Inc,GB00B45K0579,https://investorhub.financialexpress.net/Pdf/fdd/en-gb/fdd/N6N9/U/?specialunittype=ORDN&priipproductcode=
2390,Morgan Stanley US Advantage I (Portfolio Hedged) Acc,GB00BK0WFX38,https://investorhub.financialexpress.net/Pdf/fdd/en-gb/fdd/QQTJ/U/?specialunittype=ORDN&priipproductcode=
2395,MS INVF Systematic Liquid Alpha IH Hedged Acc GBP,LU2826606100,https://investorhub.financialexpress.net/Pdf/fdd/en-gb/fdd/AU0FS/DC/?specialunittype=CHDG&priipproductcode=
2400,Muzinich LongShort Credit Yield Hedged N Acc GBP,,https://investorhub.financialexpress.net/Pdf/fdd/en-gb/fdd/KJIL/DC/?specialunittype=CHDG&priipproductcode=
2405,NB Corporate Hybrid Bond P Inc GBP,IE00BD4H0M97,https://investorhub.financialexpress.net/Pdf/fdd/en-gb/fdd/NY1D/O/?specialunittype=ORDN&priipproductcode=
2410,NB Short Duration Emerging Market Debt I Acc GBP,IE00BDZRX961,https://investorhub.financialexpress.net/Pdf/fdd/en-gb/fdd/NP0B/O/?specialunittype=ORDN&priipproductcode=
2415,Neuberger Berman Short Duration High Yield Engagement I Acc GBP,IE00B7FN4H78,https://investorhub.financialexpress.net/Pdf/fdd/en-gb/fdd/0P9B/O/?specialunittype=ORDN&priipproductcode=
2420,New Capital Global Value Credit O Inc GBP,,https://investorhub.financialexpress.net/Pdf/fdd/en-gb/fdd/FVP1/O/?specialunittype=CHDG&priipproductcode=
2425,Ninety One Diversified Income I Inc-2 GBP,GB00B7700K18,https://investorhub.financialexpress.net/Pdf/fdd/en-gb/fdd/12GK/U/?specialunittype=ORDN&priipproductcode=
2430,Ninety One Global Environment I,GB00BKT89K74,https://investorhub.financialexpress.net/Pdf/fdd/en-gb/fdd/QQGL/U/?specialunittype=ORDN&priipproductcode=
2435,Ninety One Global Gold I Inc,GB00BMCR2N94,https://investorhub.financialexpress.net/Pdf/fdd/en-gb/fdd/HVFV/U/?specialunittype=ORDN&priipproductcode=
2440,Ninety One Global Macro Allocation I Dis GBP,GB00BPVFDQ57,https://investorhub.financialexpress.net/Pdf/fdd/en-gb/fdd/AL5Y1/U/?specialunittype=ORDN&priipproductcode=
2445,Ninety One Global Sustainable Equity I Inc GBP,GB00BP4T2899,https://investorhub.financialexpress.net/Pdf/fdd/en-gb/fdd/BLU8T/U/?specialunittype=ORDN&priipproductcode=
2450,Ninety One UK Franchise I 2 Inc GBP,GB00BRWQCH53,https://investorhub.financialexpress.net/Pdf/fdd/en-gb/fdd/KZ4V/U/?specialunittype=ORDN&priipproductcode=
2455,Ninety One UK Special Situations I2 Inc GBP,GB00BRWQDJ43,https://investorhub.financialexpress.net/Pdf/fdd/en-gb/fdd/KY8C/U/?specialunittype=ORDN&priipproductcode=
2460,Nomura US High Yield Bond I Hedged GBP,IE00B8H9H370,https://investorhub.financialexpress.net/Pdf/fdd/en-gb/fdd/I40T/O/?specialunittype=CHDG&priipproductcode=
2465,Nordea 1 Nordic Equity BC GBP,LU0841548497,https://investorhub.financialexpress.net/Pdf/fdd/en-gb/fdd/F7ES/DC/?specialunittype=ORDN&priipproductcode=
2470,Oldfield Partners Overstone Global All Cap Value J Acc GBP,GB00B75M3558,https://investorhub.financialexpress.net/Pdf/fdd/en-gb/fdd/0IYK/U/?specialunittype=ORDN&priipproductcode=
2475,Orbis Global Equity Standard,GB00BJ02KW01,https://investorhub.financialexpress.net/Pdf/fdd/en-gb/fdd/JYIF/U/?specialunittype=ORDN&priipproductcode=
2480,Pacific Multi-Asset Accumulator Core A Overlay GBP,IE00BD6DGH21,https://investorhub.financialexpress.net/Pdf/fdd/en-gb/fdd/O56D/DC/?specialunittype=ORDN&priipproductcode=
2485,Pictet China Equities I GBP,LU0859478934,https://investorhub.financialexpress.net/Pdf/fdd/en-gb/fdd/F4QN/O/?specialunittype=ORDN&priipproductcode=
2490,Pictet Global Emerging Debt I GBP,LU0962641436,https://investorhub.financialexpress.net/Pdf/fdd/en-gb/fdd/FC0G/O/?specialunittype=ORDN&priipproductcode=
2495,Pictet Global Sustainable Credit I GBP,LU1898274581,https://investorhub.financialexpress.net/Pdf/fdd/en-gb/fdd/PTK4/O/?specialunittype=ORDN&priipproductcode=
2500,Pictet Japanese Equity Opportunities I GBP,LU0700307720,https://investorhub.financialexpress.net/Pdf/fdd/en-gb/fdd/0NDC/O/?specialunittype=ORDN&priipproductcode=
2505,Pictet Security I dy GBP,LU0448836865,https://investorhub.financialexpress.net/Pdf/fdd/en-gb/fdd/GLO3/O/?specialunittype=ORDN&priipproductcode=
2510,PIMCO Climate Bond Inst Hedged Acc GBP,IE00BLH0Z268,https://investorhub.financialexpress.net/Pdf/fdd/en-gb/fdd/UZYB/O/?specialunittype=ORDN&priipproductcode=
2515,PIMCO GIS Dynamic Bond Inst Hedged Inc GBP,,https://investorhub.financialexpress.net/Pdf/fdd/en-gb/fdd/0XMA/O/?specialunittype=CHDG&priipproductcode=
2520,PIMCO GIS Global Investment Grade Credit Fund Inst Hedged Acc GBP,IE00B0HZNB91,https://investorhub.financialexpress.net/Pdf/fdd/en-gb/fdd/X201/O/?specialunittype=CHDG&priipproductcode=
2525,PIMCO GIS Income Inst Acc GBP,IE00BJ09LQ22,https://investorhub.financialexpress.net/Pdf/fdd/en-gb/fdd/Q0HY/O/?specialunittype=ORDN&priipproductcode=
2530,PIMCO Mortgage Opportunities Inst Hedged Acc GBP,,https://investorhub.financialexpress.net/Pdf/fdd/en-gb/fdd/NQUH/O/?specialunittype=CHDG&priipproductcode=
2535,Polar Capital Artificial Intelligence I Acc GBP,IE00BF0GL543,https://investorhub.financialexpress.net/Pdf/fdd/en-gb/fdd/O6ZP/O/?specialunittype=ORDN&priipproductcode=
2540,Polar Capital Financial Credit I Acc GBP,IE00B73PVZ22,https://investorhub.financialexpress.net/Pdf/fdd/en-gb/fdd/GUZ5/DC/?specialunittype=ORDN&priipproductcode=
2545,Polar Capital Global Convertible I Inc GBP,IE00BCDBX600,https://investorhub.financialexpress.net/Pdf/fdd/en-gb/fdd/JKEX/O/?specialunittype=ORDN&priipproductcode=
2550,Polar Capital Japan Value I GBP,IE00BYW63T38,https://investorhub.financialexpress.net/Pdf/fdd/en-gb/fdd/NZUC/O/?specialunittype=ORDN&priipproductcode=
2555,Polar Capital UK Value Opportunities I Acc GBP,IE00BD81XX91,https://investorhub.financialexpress.net/Pdf/fdd/en-gb/fdd/NL4Y/O/?specialunittype=ORDN&priipproductcode=
2560,Polen Capital Focus US Growth Inst Unhedged Dist GBP,IE00BD058W30,https://investorhub.financialexpress.net/Pdf/fdd/en-gb/fdd/OFZA/O/?specialunittype=ORDN&priipproductcode=
2565,Premier Miton Cautious Multi Asset B Acc GBP,GB00B0W1V856,https://investorhub.financialexpress.net/Pdf/fdd/en-gb/fdd/QH74/U/?specialunittype=ORDN&priipproductcode=
2570,Premier Miton Diversified Cautious Growth D Inc GBP,GB00BHNZ2P92,https://investorhub.financialexpress.net/Pdf/fdd/en-gb/fdd/PWXF/U/?specialunittype=ORDN&priipproductcode=
2575,Premier Miton Diversified Income D Inc GBP,GB00BYPDV970,https://investorhub.financialexpress.net/Pdf/fdd/en-gb/fdd/NWBC/U/?specialunittype=ORDN&priipproductcode=
2580,Premier Miton Global Infrastructure Income B Inc GBP,GB00BD3H9M38,https://investorhub.financialexpress.net/Pdf/fdd/en-gb/fdd/NQAN/U/?specialunittype=ORDN&priipproductcode=
2585,Premier Miton Liberation IV B Inc GBP,GB00BN893S83,https://investorhub.financialexpress.net/Pdf/fdd/en-gb/fdd/KK4N/U/?specialunittype=ORDN&priipproductcode=
2590,Premier Miton Liberation V C Inc GBP,GB00B3NZPP27,https://investorhub.financialexpress.net/Pdf/fdd/en-gb/fdd/LWE6/U/?specialunittype=ORDN&priipproductcode=
2595,Premier Miton Monthly Income C Acc GBP,GB00BTHH0955,https://investorhub.financialexpress.net/Pdf/fdd/en-gb/fdd/M25L/U/?specialunittype=ORDN&priipproductcode=
2600,Premier Miton Multi-Asset Global Growth C Inc GBP,GB00B7ZTRZ49,https://investorhub.financialexpress.net/Pdf/fdd/en-gb/fdd/GH6G/U/?specialunittype=ORDN&priipproductcode=
2605,Premier Miton Optimum Income C Inc GBP,GB00B3DDDX03,https://investorhub.financialexpress.net/Pdf/fdd/en-gb/fdd/DBX1/U/?specialunittype=ORDN&priipproductcode=
2610,Premier Miton Responsible UK Equity C Inc GBP,GB0004073002,https://investorhub.financialexpress.net/Pdf/fdd/en-gb/fdd/BY56/U/?specialunittype=ORDN&priipproductcode=
2615,Premier Miton Tellworth UK Select A Inc GBP,GB00BNY7YL66,https://investorhub.financialexpress.net/Pdf/fdd/en-gb/fdd/KZXR/U/?specialunittype=ORDN&priipproductcode=
2620,Premier Miton UK Money Market B Inc GBP,GB00B8HDQ548,https://investorhub.financialexpress.net/Pdf/fdd/en-gb/fdd/GH6L/U/?specialunittype=ORDN&priipproductcode=
2625,Premier Miton UK Value Opportunities B Acc GBP,GB00B8QW1M42,https://investorhub.financialexpress.net/Pdf/fdd/en-gb/fdd/ICDB/U/?specialunittype=ORDN&priipproductcode=
2630,Pyrford Global Total Return (Sterling) B Acc GBP,IE00BZ0CQG87,https://investorhub.financialexpress.net/Pdf/fdd/en-gb/fdd/MUBA/O/?specialunittype=ORDN&priipproductcode=
2635,Quilter Investors Cirilium Balanced Blend Portfolio U1 Acc GBP,GB00BJV3LS54,https://investorhub.financialexpress.net/Pdf/fdd/en-gb/fdd/QCKU/U/?specialunittype=ORDN&priipproductcode=
2640,Quilter Investors Cirilium Conservative Portfolio R Acc GBP,GB00B6XW5B09,https://investorhub.financialexpress.net/Pdf/fdd/en-gb/fdd/0OH0/U/?specialunittype=ORDN&priipproductcode=
2645,Quilter Investors Cirilium Moderate Passive Portfolio R Acc GBP,GB00B8Y8NJ51,https://investorhub.financialexpress.net/Pdf/fdd/en-gb/fdd/I71C/U/?specialunittype=ORDN&priipproductcode=
2650,Quilter Investors Creation Moderate Portfolio U1 Acc GBP,GB00B88LG353,https://investorhub.financialexpress.net/Pdf/fdd/en-gb/fdd/GW0F/U/?specialunittype=ORDN&priipproductcode=
2655,Quilter Investors Monthly Income and Growth Portfolio U1 Inc GBP,GB00BJMXGY51,https://investorhub.financialexpress.net/Pdf/fdd/en-gb/fdd/Q9S4/U/?specialunittype=ORDN&priipproductcode=
2660,Rathbone Defensive Growth Portfolio S Inc,GB00BKKK7X16,https://investorhub.financialexpress.net/Pdf/fdd/en-gb/fdd/R3NR/U/?specialunittype=ORDN&priipproductcode=
2665,Rathbone Ethical Bond Fund I Inc GBP,GB00B7FQJT36,https://investorhub.financialexpress.net/Pdf/fdd/en-gb/fdd/0WF8/U/?specialunittype=ORDN&priipproductcode=
2670,Rathbone Greenbank Dynamic Growth Portfolio S Inc,GB00BMQC6H25,https://investorhub.financialexpress.net/Pdf/fdd/en-gb/fdd/U9D8/U/?specialunittype=ORDN&priipproductcode=
2675,Rathbone Greenbank Total Return Portfolio S Acc,GB00BMQC4S99,https://investorhub.financialexpress.net/Pdf/fdd/en-gb/fdd/WD4Q/U/?specialunittype=ORDN&priipproductcode=
2680,Rathbone Income I Inc GBP,GB00B7FQLQ43,https://investorhub.financialexpress.net/Pdf/fdd/en-gb/fdd/0WFI/U/?specialunittype=ORDN&priipproductcode=
2685,Rathbone Strategic Income Portfolio Acc GBP,GB00BY9BT482,https://investorhub.financialexpress.net/Pdf/fdd/en-gb/fdd/MQ8N/U/?specialunittype=ORDN&priipproductcode=
2690,Rathbone UK Opportunities I Inc GBP,GB00B77H7W31,https://investorhub.financialexpress.net/Pdf/fdd/en-gb/fdd/0WFM/U/?specialunittype=ORDN&priipproductcode=
2695,Redwheel Global Emerging Markets R Dis GBP,LU1868678746,https://investorhub.financialexpress.net/Pdf/fdd/en-gb/fdd/PQO0/O/?specialunittype=ORDN&priipproductcode=
2700,Regnan Sustainable Water and Waste I Acc GBP,GB00BMYXD320,https://investorhub.financialexpress.net/Pdf/fdd/en-gb/fdd/TI3S/U/?specialunittype=ORDN&priipproductcode=
2705,River Global RGI Global Income and Growth B Dis GBP,GB00BTLMGS77,https://investorhub.financialexpress.net/Pdf/fdd/en-gb/fdd/BTHAI/U/?specialunittype=ORDN&priipproductcode=
2710,River Global RGI UK Opportunities B Acc GBP,GB00BW01H385,https://investorhub.financialexpress.net/Pdf/fdd/en-gb/fdd/BXL9J/U/?specialunittype=ORDN&priipproductcode=
2715,Robeco Global Credits FH GBP,,https://investorhub.financialexpress.net/Pdf/fdd/en-gb/fdd/E95P/O/?specialunittype=CHDG&priipproductcode=
2720,Robeco Smart Materials G GBP,LU2145464694,https://investorhub.financialexpress.net/Pdf/fdd/en-gb/fdd/H2XT/DC/?specialunittype=ORDN&priipproductcode=
2725,Royal London Asia Pacific ex Japan Equity Tilt Z Acc,GB00B68SHD90,https://investorhub.financialexpress.net/Pdf/fdd/en-gb/fdd/RD25/U/?specialunittype=ORDN&priipproductcode=
2730,Royal London Emerging Markets Equity Tilt M Acc GBP,GB00BQ2NKN13,https://investorhub.financialexpress.net/Pdf/fdd/en-gb/fdd/BY8CS/U/?specialunittype=ORDN&priipproductcode=
2735,Royal London Europe ex UK Equity Tilt Z,GB00B8HF4Y56,https://investorhub.financialexpress.net/Pdf/fdd/en-gb/fdd/JDXR/U/?specialunittype=ORDN&priipproductcode=
2740,Royal London Global Equity Diversified M Acc,GB00BF93WF36,https://investorhub.financialexpress.net/Pdf/fdd/en-gb/fdd/O5ZQ/U/?specialunittype=ORDN&priipproductcode=
2745,Royal London Global Sustainable Equity M Acc,GB00BL6V0581,https://investorhub.financialexpress.net/Pdf/fdd/en-gb/fdd/QUCM/U/?specialunittype=ORDN&priipproductcode=
2750,Royal London GMAP Defensive M Acc,GB00BD8RSJ84,https://investorhub.financialexpress.net/Pdf/fdd/en-gb/fdd/MZTK/U/?specialunittype=ORDN&priipproductcode=
2755,Royal London GMAP Dynamic Equity M Inc,GB00BD8RSK99,https://investorhub.financialexpress.net/Pdf/fdd/en-gb/fdd/MZTR/U/?specialunittype=ORDN&priipproductcode=
2760,Royal London Index Linked M Inc,GB00B3MZ2071,https://investorhub.financialexpress.net/Pdf/fdd/en-gb/fdd/IST0/U/?specialunittype=ORDN&priipproductcode=
2765,Royal London Short Duration Credit M Acc,GB00BJ4KW792,https://investorhub.financialexpress.net/Pdf/fdd/en-gb/fdd/P3JN/U/?specialunittype=ORDN&priipproductcode=
2770,Royal London Short Duration Global Index Linked M Inc,GB00BD050F05,https://investorhub.financialexpress.net/Pdf/fdd/en-gb/fdd/JPBV/U/?specialunittype=ORDN&priipproductcode=
2775,Royal London Short Term Money Market Y Acc,GB00B8XYYQ86,https://investorhub.financialexpress.net/Pdf/fdd/en-gb/fdd/GWUO/U/?specialunittype=ORDN&priipproductcode=
2780,Royal London Sterling Extra Yield Bond A Inc,IE0032571485,https://investorhub.financialexpress.net/Pdf/fdd/en-gb/fdd/RP65/O/?specialunittype=ORDN&priipproductcode=
2785,Royal London Sustainable Leaders Trust C Acc,GB00B7V23Z99,https://investorhub.financialexpress.net/Pdf/fdd/en-gb/fdd/GVVX/U/?specialunittype=ORDN&priipproductcode=
2790,Royal London Sustainable Short Duration Corporate Bond M Inc,GB00BLDC8B60,https://investorhub.financialexpress.net/Pdf/fdd/en-gb/fdd/X1EM/U/?specialunittype=ORDN&priipproductcode=
2795,Royal London UK Core Equity Tilt M Acc GBP,GB00BQ2NKS67,https://investorhub.financialexpress.net/Pdf/fdd/en-gb/fdd/BY8EW/U/?specialunittype=ORDN&priipproductcode=
2800,Royal London UK Equity Income M Inc,GB00B3M9JJ78,https://investorhub.financialexpress.net/Pdf/fdd/en-gb/fdd/LWG4/U/?specialunittype=ORDN&priipproductcode=
2805,Royal London UK Income With Growth Trust A Inc,GB0001598050,https://investorhub.financialexpress.net/Pdf/fdd/en-gb/fdd/XI02/U/?specialunittype=ORDN&priipproductcode=
2810,Royal London US Equity Trust A Inc,GB0030038359,https://investorhub.financialexpress.net/Pdf/fdd/en-gb/fdd/XI04/U/?specialunittype=ORDN&priipproductcode=
2815,Sanlam Ninety One Real Assets A Acc GBP,IE00BJ5CB555,https://investorhub.financialexpress.net/Pdf/fdd/en-gb/fdd/QLET/O/?specialunittype=ORDN&priipproductcode=
2820,Santander Atlas Portfolio 4 IA,GB00BD3CW292,https://investorhub.financialexpress.net/Pdf/fdd/en-gb/fdd/JQ6M/U/?specialunittype=ORDN&priipproductcode=
2825,Santander Enhanced Income Portfolio II,GB00B3RJG579,https://investorhub.financialexpress.net/Pdf/fdd/en-gb/fdd/F2N6/U/?specialunittype=ORDN&priipproductcode=
2830,Sarasin Food & Agriculture Opportunities P Inc,GB00B8GJCL12,https://investorhub.financialexpress.net/Pdf/fdd/en-gb/fdd/GSJM/U/?specialunittype=ORDN&priipproductcode=
2835,Sarasin Global Equity Real Return P Inc,GB00B7SZSV27,https://investorhub.financialexpress.net/Pdf/fdd/en-gb/fdd/GSKU/U/?specialunittype=ORDN&priipproductcode=
2840,Sarasin Responsible Corporate Bond P Acc,GB00BYMB5T28,https://investorhub.financialexpress.net/Pdf/fdd/en-gb/fdd/NILX/U/?specialunittype=ORDN&priipproductcode=
2845,Sarasin Responsible Global Equity P Inc,GB00B75JDT07,https://investorhub.financialexpress.net/Pdf/fdd/en-gb/fdd/GSJU/U/?specialunittype=ORDN&priipproductcode=
2850,Sarasin Thematic Global Equity P Hedged Inc GBP,GB00BLB2NK26,https://investorhub.financialexpress.net/Pdf/fdd/en-gb/fdd/DQ9X/U/?specialunittype=CHDG&priipproductcode=
2855,Schroder Asian Alpha Plus Z Inc,GB00B5V2VR34,https://investorhub.financialexpress.net/Pdf/fdd/en-gb/fdd/NNC5/U/?specialunittype=ORDN&priipproductcode=
2860,Schroder Asian Income Z Acc,GB00B5BJ7M17,https://investorhub.financialexpress.net/Pdf/fdd/en-gb/fdd/NNC7/U/?specialunittype=ORDN&priipproductcode=
2865,Schroder Blended Portfolio 6 Z,GB00BF782N88,https://investorhub.financialexpress.net/Pdf/fdd/en-gb/fdd/DZ0R/U/?specialunittype=ORDN&priipproductcode=
2870,Schroder European Climate Transition Z Acc,GB00B6S00Y77,https://investorhub.financialexpress.net/Pdf/fdd/en-gb/fdd/11LY/U/?specialunittype=ORDN&priipproductcode=
2875,Schroder European Smaller Companies Z Acc,GB00B76V5M20,https://investorhub.financialexpress.net/Pdf/fdd/en-gb/fdd/0HCV/U/?specialunittype=ORDN&priipproductcode=
2880,Schroder Gilt and Fixed Interest Z Acc,GB00BYTQ7F09,https://investorhub.financialexpress.net/Pdf/fdd/en-gb/fdd/E2OL/U/?specialunittype=ORDN&priipproductcode=
2885,Schroder Global Cities Real Estate Z Hedged,,https://investorhub.financialexpress.net/Pdf/fdd/en-gb/fdd/NQFT/U/?specialunittype=CHDG&priipproductcode=
2890,Schroder Global Equity Income Z Inc,GB00B76V7N76,https://investorhub.financialexpress.net/Pdf/fdd/en-gb/fdd/0HD0/U/?specialunittype=ORDN&priipproductcode=
2895,Schroder Global Recovery Z Acc,GB00BYRJXL91,https://investorhub.financialexpress.net/Pdf/fdd/en-gb/fdd/MUXT/U/?specialunittype=ORDN&priipproductcode=
2900,Schroder Global Sustainable Value Equity Z,GB00BF783V38,https://investorhub.financialexpress.net/Pdf/fdd/en-gb/fdd/OX5Q/U/?specialunittype=ORDN&priipproductcode=
2905,Schroder Income Portfolio Z Acc,GB00B4K1MN77,https://investorhub.financialexpress.net/Pdf/fdd/en-gb/fdd/LAV8/U/?specialunittype=ORDN&priipproductcode=
2910,Schroder ISF Asian Total Return C Dis NAV GBP AV,LU0378802051,https://investorhub.financialexpress.net/Pdf/fdd/en-gb/fdd/EOD1/O/?specialunittype=ORDN&priipproductcode=
2915,Schroder ISF QEP Global ESG C Acc Nav GBP,LU1775314054,https://investorhub.financialexpress.net/Pdf/fdd/en-gb/fdd/OSON/DC/?specialunittype=ORDN&priipproductcode=
2920,Schroder Managed Wealth Portfolio Z Acc,,https://investorhub.financialexpress.net/Pdf/fdd/en-gb/fdd/GGMR/U/?specialunittype=ORDN&priipproductcode=
2925,Schroder Monthly Income Z Inc,GB00B66FVB83,https://investorhub.financialexpress.net/Pdf/fdd/en-gb/fdd/12H7/U/?specialunittype=ORDN&priipproductcode=
2930,Schroder QEP Global Core A Acc,GB00B5310487,https://investorhub.financialexpress.net/Pdf/fdd/en-gb/fdd/M2T8/U/?specialunittype=ORDN&priipproductcode=
2935,Schroder Sterling Corporate Bond Z Inc,GB00B7458508,https://investorhub.financialexpress.net/Pdf/fdd/en-gb/fdd/11LR/U/?specialunittype=ORDN&priipproductcode=
2940,Schroder Strategic Credit Z Acc,GB00BJZ2ZC09,https://investorhub.financialexpress.net/Pdf/fdd/en-gb/fdd/K84E/U/?specialunittype=ORDN&priipproductcode=
2945,Schroder Sustainable Future Multi-Asset Z Inc,GB00B2Q1N909,https://investorhub.financialexpress.net/Pdf/fdd/en-gb/fdd/BSP7/U/?specialunittype=ORDN&priipproductcode=
2950,Schroder Tokyo Z Hedged Inc GBP,GB00B8V8R746,https://investorhub.financialexpress.net/Pdf/fdd/en-gb/fdd/IDFY/U/?specialunittype=CHDG&priipproductcode=
2955,Schroder UK Mid 250 Z Acc,GB00B76V7S22,https://investorhub.financialexpress.net/Pdf/fdd/en-gb/fdd/0HD3/U/?specialunittype=ORDN&priipproductcode=
2960,Schroder UK-Listed Equity Income Maximiser Z Acc,,https://investorhub.financialexpress.net/Pdf/fdd/en-gb/fdd/H1PC/U/?specialunittype=ORDN&priipproductcode=
2965,Schroder US Smaller Companies Z Acc,GB00B7LDL923,https://investorhub.financialexpress.net/Pdf/fdd/en-gb/fdd/0V2S/U/?specialunittype=ORDN&priipproductcode=
2970,Scottish Widows High Income Bd A Acc,GB00BKYRZ014,https://investorhub.financialexpress.net/Pdf/fdd/en-gb/fdd/R4CB/U/?specialunittype=ORDN&priipproductcode=
2975,Scottish Widows Horizon Multi-Asset 2 Z Inc,GB00BTKH4903,https://investorhub.financialexpress.net/Pdf/fdd/en-gb/fdd/M47Q/U/?specialunittype=ORDN&priipproductcode=
2980,Scottish Widows Horizon Multi-Asset 5 Z Acc,GB00BTKH4J06,https://investorhub.financialexpress.net/Pdf/fdd/en-gb/fdd/M47X/U/?specialunittype=ORDN&priipproductcode=
2985,Slater Income P Inc,GB00B905XJ71,https://investorhub.financialexpress.net/Pdf/fdd/en-gb/fdd/I3PP/U/?specialunittype=ORDN&priipproductcode=
2990,Stewart Investors Asia Pacific Leaders B Acc GBP,GB0033874768,https://investorhub.financialexpress.net/Pdf/fdd/en-gb/fdd/QI53/U/?specialunittype=ORDN&priipproductcode=
2995,Stewart Investors Indian Subcontinent All Cap B Acc GBP,GB00B1FXTG93,https://investorhub.financialexpress.net/Pdf/fdd/en-gb/fdd/I271/U/?specialunittype=ORDN&priipproductcode=
3000,SVS AllianceBernstein Concentrated US Equity I Acc,GB00BL4SF671,https://investorhub.financialexpress.net/Pdf/fdd/en-gb/fdd/QTSU/U/?specialunittype=ORDN&priipproductcode=
3005,SVS Baker Steel Gold & Precious Metals B Acc,GB00BNGMZG14,https://investorhub.financialexpress.net/Pdf/fdd/en-gb/fdd/KJBY/U/?specialunittype=ORDN&priipproductcode=
3010,SVS Brooks Macdonald Blueprint Strategic Growth A Acc,GB00BDX8Y871,https://investorhub.financialexpress.net/Pdf/fdd/en-gb/fdd/JPCN/U/?specialunittype=ORDN&priipproductcode=
3015,SVS Brown Shipley Dynamic I Acc,GB00B3K4J724,https://investorhub.financialexpress.net/Pdf/fdd/en-gb/fdd/HUD3/U/?specialunittype=ORDN&priipproductcode=
3020,SVS Brown Shipley Income I Inc,GB00B3QCN234,https://investorhub.financialexpress.net/Pdf/fdd/en-gb/fdd/HUC8/U/?specialunittype=ORDN&priipproductcode=
3025,SVS Cornelian Defensive D Acc,GB00B5N17T22,https://investorhub.financialexpress.net/Pdf/fdd/en-gb/fdd/IYL5/U/?specialunittype=ORDN&priipproductcode=
3030,SVS Cornelian Growth D Inc,GB00B68Y9S62,https://investorhub.financialexpress.net/Pdf/fdd/en-gb/fdd/MTQ8/U/?specialunittype=ORDN&priipproductcode=
3035,SVS Cornelian Managed Growth RMP G Acc,GB00BD72ZY86,https://investorhub.financialexpress.net/Pdf/fdd/en-gb/fdd/NGCM/U/?specialunittype=ORDN&priipproductcode=
3040,SVS Cornelian Progressive D Inc,GB00B5Q8N588,https://investorhub.financialexpress.net/Pdf/fdd/en-gb/fdd/IYM4/U/?specialunittype=ORDN&priipproductcode=
3045,SVS Kennox Strategic Value I Acc,GB00B8Y8GR43,https://investorhub.financialexpress.net/Pdf/fdd/en-gb/fdd/JAQU/U/?specialunittype=ORDN&priipproductcode=
3050,T. Rowe Price Emerging Local Markets Bond Fund Q Acc GBP,LU2647895833,https://investorhub.financialexpress.net/Pdf/fdd/en-gb/fdd/AVUA9/O/?specialunittype=ORDN&priipproductcode=
3055,T. Rowe Price Global Focused Growth Equity C Acc,GB00BD446774,https://investorhub.financialexpress.net/Pdf/fdd/en-gb/fdd/C3QB/U/?specialunittype=ORDN&priipproductcode=
3060,T. Rowe Price Global Select Equity Fund C Acc GBP,GB00BLFG6V23,https://investorhub.financialexpress.net/Pdf/fdd/en-gb/fdd/U58U/U/?specialunittype=ORDN&priipproductcode=
3065,T. Rowe Price US All-Cap Opportunities Equity C Acc,GB00BLFGB288,https://investorhub.financialexpress.net/Pdf/fdd/en-gb/fdd/UD4J/U/?specialunittype=ORDN&priipproductcode=
3070,T. Rowe Price US Large Cap Growth Equity C Acc,GB00BD5FHW12,https://investorhub.financialexpress.net/Pdf/fdd/en-gb/fdd/P2F7/U/?specialunittype=ORDN&priipproductcode=
3075,T. Rowe Price US Large Cap Value Equity Q GBP,LU1028172226,https://investorhub.financialexpress.net/Pdf/fdd/en-gb/fdd/K6ZP/O/?specialunittype=ORDN&priipproductcode=
3080,T.Rowe Price Global Value Equity C Acc GBP,GB00BLFG9N53,https://investorhub.financialexpress.net/Pdf/fdd/en-gb/fdd/TIZ6/U/?specialunittype=ORDN&priipproductcode=
3085,Templeton Frontier Markets W Acc GBP,LU0768359852,https://investorhub.financialexpress.net/Pdf/fdd/en-gb/fdd/G26X/DC/?specialunittype=ORDN&priipproductcode=
3090,Templeton Global Total Return W MDis GBP,LU0768361833,https://investorhub.financialexpress.net/Pdf/fdd/en-gb/fdd/G27J/DC/?specialunittype=ORDN&priipproductcode=
3095,The MI Hawksmoor Distribution C Inc,GB00BJ4GVM54,https://investorhub.financialexpress.net/Pdf/fdd/en-gb/fdd/K29C/U/?specialunittype=ORDN&priipproductcode=
3100,The MI Hawksmoor Vanbrugh C Acc,GB00BJ4GVQ92,https://investorhub.financialexpress.net/Pdf/fdd/en-gb/fdd/K29F/U/?specialunittype=ORDN&priipproductcode=
3105,Thesis Stonehage Fleming Opportunities B,GB0032211103,https://investorhub.financialexpress.net/Pdf/fdd/en-gb/fdd/C122/U/?specialunittype=ORDN&priipproductcode=
3110,TM Brickwood Global Value R Inc GBP,GB00BTKVYW53,https://investorhub.financialexpress.net/Pdf/fdd/en-gb/fdd/BSH7M/U/?specialunittype=ORDN&priipproductcode=
3115,TM Castlefield Thoughtful Growth Portfolio G Income,GB00BYXG3H04,https://investorhub.financialexpress.net/Pdf/fdd/en-gb/fdd/ONCD/U/?specialunittype=ORDN&priipproductcode=
3120,TM Cerno Select C Inc,GB00BCZXTN36,https://investorhub.financialexpress.net/Pdf/fdd/en-gb/fdd/JMCJ/U/?specialunittype=ORDN&priipproductcode=
3125,TM Gravis Clean Energy Income C Inc GBP,GB00BFN4H461,https://investorhub.financialexpress.net/Pdf/fdd/en-gb/fdd/OB3D/U/?specialunittype=ORDN&priipproductcode=
3130,TM Gravis UK Infrastructure Income I Inc GBP,GB00BYVB3Q65,https://investorhub.financialexpress.net/Pdf/fdd/en-gb/fdd/E5JG/U/?specialunittype=ORDN&priipproductcode=
3135,TM Natixis Harris Associates Global Concentrated Equity N/A GBP,GB00BN405018,https://investorhub.financialexpress.net/Pdf/fdd/en-gb/fdd/KMPZ/U/?specialunittype=ORDN&priipproductcode=
3140,TM Oberon UK Core B Acc GBP,GB00B5839S67,https://investorhub.financialexpress.net/Pdf/fdd/en-gb/fdd/NDQ7/U/?specialunittype=ORDN&priipproductcode=
3145,TM Quilter Cheviot Sustainable Opportunities Growth B Inc GBP,GB00BMHDNB71,https://investorhub.financialexpress.net/Pdf/fdd/en-gb/fdd/RIV9/U/?specialunittype=ORDN&priipproductcode=
3150,TM Redwheel UK Equity Income R Acc GBP,GB00BG341295,https://investorhub.financialexpress.net/Pdf/fdd/en-gb/fdd/PB8B/U/?specialunittype=ORDN&priipproductcode=
