index,name,isin,url
5,7IM AAP Balanced C Inc,GB00B2PB2V64,https://investorhub.financialexpress.net/Pdf/fdd/en-gb/fdd/BFB4/U/?specialunittype=ORDN&priipproductcode=
10,7IM AAP Moderately Cautious C Acc,GB00B2PB2168,https://investorhub.financialexpress.net/Pdf/fdd/en-gb/fdd/BFB1/U/?specialunittype=ORDN&priipproductcode=
15,7IM Balanced C Inc,GB0033959296,https://investorhub.financialexpress.net/Pdf/fdd/en-gb/fdd/QI98/U/?specialunittype=ORDN&priipproductcode=
20,7IM Pathbuilder 1 C Acc,GB00BMDPBQ86,https://investorhub.financialexpress.net/Pdf/fdd/en-gb/fdd/R2FS/U/?specialunittype=ORDN&priipproductcode=
25,7IM Pathbuilder 3 C Inc,GB00BMDPC876,https://investorhub.financialexpress.net/Pdf/fdd/en-gb/fdd/R2G1/U/?specialunittype=ORDN&priipproductcode=
30,Aberforth UK Small Companies,GB0000072727,https://investorhub.financialexpress.net/Pdf/fdd/en-gb/fdd/A109/U/?specialunittype=ORDN&priipproductcode=
35,abrdn American Equity I Acc,GB00B0XWN259,https://investorhub.financialexpress.net/Pdf/fdd/en-gb/fdd/KZ79/U/?specialunittype=ORDN&priipproductcode=
40,abrdn Diversified Growth and Income I Acc,GB00B1C42779,https://investorhub.financialexpress.net/Pdf/fdd/en-gb/fdd/GNOP/U/?specialunittype=ORDN&priipproductcode=
45,abrdn Emerging Markets Equity I Acc,GB0033227561,https://investorhub.financialexpress.net/Pdf/fdd/en-gb/fdd/ZY91/U/?specialunittype=ORDN&priipproductcode=
50,abrdn Ethical Corporate Bond Institutional Inc GBP,GB00B0LNNL97,https://investorhub.financialexpress.net/Pdf/fdd/en-gb/fdd/TJ50/U/?specialunittype=ORDN&priipproductcode=
55,abrdn European Equity Tracker B Acc,GB00BGMK1394,https://investorhub.financialexpress.net/Pdf/fdd/en-gb/fdd/PZCV/U/?specialunittype=ORDN&priipproductcode=
60,abrdn Global Balanced Growth Institutional Inc GBP,GB0004331566,https://investorhub.financialexpress.net/Pdf/fdd/en-gb/fdd/SL80/U/?specialunittype=ORDN&priipproductcode=
65,abrdn Global Government Bond Tracker B Acc,GB00BK80KQ76,https://investorhub.financialexpress.net/Pdf/fdd/en-gb/fdd/UW9O/U/?specialunittype=ORDN&priipproductcode=
70,abrdn Global Infrastructure Equity Institutional Inc GBP,GB00B74TZJ51,https://investorhub.financialexpress.net/Pdf/fdd/en-gb/fdd/0O25/U/?specialunittype=ORDN&priipproductcode=
75,abrdn High Yield Bond Institutional Acc GBP,GB0000936244,https://investorhub.financialexpress.net/Pdf/fdd/en-gb/fdd/ST01/U/?specialunittype=ORDN&priipproductcode=
80,abrdn Latin American Equity I Acc,GB00B4R0SD95,https://investorhub.financialexpress.net/Pdf/fdd/en-gb/fdd/GNON/U/?specialunittype=ORDN&priipproductcode=
85,abrdn MyFolio Core V Institutional Fixed Inc GBP,GB00BHZCRR59,https://investorhub.financialexpress.net/Pdf/fdd/en-gb/fdd/Q4CJ/U/?specialunittype=ORDN&priipproductcode=
90,abrdn MyFolio Index III Inst B Acc GBP,GB00BHZCQT09,https://investorhub.financialexpress.net/Pdf/fdd/en-gb/fdd/Q1V1/U/?specialunittype=ORDN&priipproductcode=
95,abrdn MyFolio Multi Manager II Inst Acc GBP,GB00B55L0T15,https://investorhub.financialexpress.net/Pdf/fdd/en-gb/fdd/KRI3/U/?specialunittype=ORDN&priipproductcode=
100,abrdn Real Estate Feeder Institutional Inc GBP,GB00BP8YY396,https://investorhub.financialexpress.net/Pdf/fdd/en-gb/fdd/LN1Z/U/?specialunittype=ORDN&priipproductcode=
105,abrdn Short Dated Global Corporate Bond Tracker B Acc,GB00BG08N399,https://investorhub.financialexpress.net/Pdf/fdd/en-gb/fdd/PZV5/U/?specialunittype=ORDN&priipproductcode=
110,abrdn SICAV I - Asia Pacific Sustainable Equity X Acc GBP,LU0837964567,https://investorhub.financialexpress.net/Pdf/fdd/en-gb/fdd/GWQI/O/?specialunittype=ORDN&priipproductcode=
115,abrdn SICAV I - Emerging Markets Smaller Companies X Acc GBP,LU0837974368,https://investorhub.financialexpress.net/Pdf/fdd/en-gb/fdd/GWRS/O/?specialunittype=ORDN&priipproductcode=
120,abrdn SICAV I - Indian Equity X Acc GBP,LU0837977031,https://investorhub.financialexpress.net/Pdf/fdd/en-gb/fdd/GWSC/O/?specialunittype=ORDN&priipproductcode=
125,abrdn SICAV II SICAV II - Macro Fixed Income B Acc GBP,LU1438963313,https://investorhub.financialexpress.net/Pdf/fdd/en-gb/fdd/EA7W/O/?specialunittype=ORDN&priipproductcode=
130,abrdn Sterling Money Market I Acc,GB00B1C42332,https://investorhub.financialexpress.net/Pdf/fdd/en-gb/fdd/A6F4/U/?specialunittype=ORDN&priipproductcode=
135,abrdn Strategic Bond I Gr Acc,GB00BWK28168,https://investorhub.financialexpress.net/Pdf/fdd/en-gb/fdd/MOZI/U/?specialunittype=ORDN&priipproductcode=
140,abrdn UK Ethical Equity Inst Inc GBP,GB00BVFNS519,https://investorhub.financialexpress.net/Pdf/fdd/en-gb/fdd/M3IT/U/?specialunittype=ORDN&priipproductcode=
145,abrdn UK Mid Cap Equity I Acc,GB00B0XWNT29,https://investorhub.financialexpress.net/Pdf/fdd/en-gb/fdd/GNOU/U/?specialunittype=ORDN&priipproductcode=
150,abrdn UK Sustainable Equity I Inc,GB00B131GH54,https://investorhub.financialexpress.net/Pdf/fdd/en-gb/fdd/GNOR/U/?specialunittype=ORDN&priipproductcode=
155,Aegon Absolute Return Bond C Acc GBP,IE00B6SLQ646,https://investorhub.financialexpress.net/Pdf/fdd/en-gb/fdd/0SVT/O/?specialunittype=ORDN&priipproductcode=
160,Aegon Ethical Cautious Managed B Inc,GB00B7TCPG66,https://investorhub.financialexpress.net/Pdf/fdd/en-gb/fdd/JCSG/U/?specialunittype=ORDN&priipproductcode=
165,Aegon Global Equity Income B Acc GBP,,https://investorhub.financialexpress.net/Pdf/fdd/en-gb/fdd/JRQY/O/?specialunittype=ORDN&priipproductcode=
170,Aegon High Yield Bond B Inc,GB00B1N9DY51,https://investorhub.financialexpress.net/Pdf/fdd/en-gb/fdd/CWS6/U/?specialunittype=ORDN&priipproductcode=
175,Aegon Investment Grade Bond S Acc GBP,GB00BF0W2M61,https://investorhub.financialexpress.net/Pdf/fdd/en-gb/fdd/OBDV/U/?specialunittype=ORDN&priipproductcode=
180,Aegon Sterling Corporate Bond S Acc GBP,GB00BF0W2P92,https://investorhub.financialexpress.net/Pdf/fdd/en-gb/fdd/OBDX/U/?specialunittype=ORDN&priipproductcode=
185,Aegon Sustainable Equity B Acc GBP,GB0007274516,https://investorhub.financialexpress.net/Pdf/fdd/en-gb/fdd/SN49/U/?specialunittype=ORDN&priipproductcode=
190,Allianz Best Styles Global AC Equity C Acc,GB00BYQ91X80,https://investorhub.financialexpress.net/Pdf/fdd/en-gb/fdd/E2EU/U/?specialunittype=ORDN&priipproductcode=
195,Allianz Green Bond P2 (H2-GBP) NAV GBP,LU1566179385,https://investorhub.financialexpress.net/Pdf/fdd/en-gb/fdd/NSTD/O/?specialunittype=CHDG&priipproductcode=
200,Allianz Total Return Asian Equity C,GB00B1FRQV53,https://investorhub.financialexpress.net/Pdf/fdd/en-gb/fdd/BKB9/U/?specialunittype=ORDN&priipproductcode=
205,Allspring (Lux) Worldwide - Global Income Z (hedged) Acc GBP,LU2905573486,https://investorhub.financialexpress.net/Pdf/fdd/en-gb/fdd/BLERE/DC/?specialunittype=CHDG&priipproductcode=
210,Amundi Europe Ex UK Equity R2 C Acc GBP,LU2823265405,https://investorhub.financialexpress.net/Pdf/fdd/en-gb/fdd/AUD35/DC/?specialunittype=ORDN&priipproductcode=
215,ARC TIME Property Long Income & Growth Feeder Trust J Net Inc GBP,GB00BN7DJM78,https://investorhub.financialexpress.net/Pdf/fdd/en-gb/fdd/WQPZ/U/?specialunittype=ORDN&priipproductcode=
220,Artemis Corporate Bond I Inc GBP,GB00BKPWGV34,https://investorhub.financialexpress.net/Pdf/fdd/en-gb/fdd/QL4L/U/?specialunittype=ORDN&priipproductcode=
225,Artemis High Income I Quarterly Acc,GB00BJMD6R83,https://investorhub.financialexpress.net/Pdf/fdd/en-gb/fdd/Q2BO/U/?specialunittype=ORDN&priipproductcode=
230,Artemis Short-Duration Strategic Bond I Acc,GB00BJXPPH66,https://investorhub.financialexpress.net/Pdf/fdd/en-gb/fdd/QQHX/U/?specialunittype=ORDN&priipproductcode=
235,Artemis SmartGARP European Equity IH Inc GBP,GB00BR4TV084,https://investorhub.financialexpress.net/Pdf/fdd/en-gb/fdd/BLDSW/U/?specialunittype=CHDG&priipproductcode=
240,Artemis SmartGARP Global Smaller Companies I Acc,GB00B568S201,https://investorhub.financialexpress.net/Pdf/fdd/en-gb/fdd/A0CW/U/?specialunittype=ORDN&priipproductcode=
245,Artemis Strategic Bond I Monthly Inc,GB00B2PLJS27,https://investorhub.financialexpress.net/Pdf/fdd/en-gb/fdd/BUI0/U/?specialunittype=ORDN&priipproductcode=
250,Artemis UK Smaller Companies I Acc,GB00B2PLJL57,https://investorhub.financialexpress.net/Pdf/fdd/en-gb/fdd/KVH2/U/?specialunittype=ORDN&priipproductcode=
255,Artemis US Extended Alpha I Hedged Acc GBP,,https://investorhub.financialexpress.net/Pdf/fdd/en-gb/fdd/N2XK/U/?specialunittype=CHDG&priipproductcode=
260,Artemis US Smaller Companies I Hedged Acc GBP,GB00BK6RLD43,https://investorhub.financialexpress.net/Pdf/fdd/en-gb/fdd/Q9S7/U/?specialunittype=CHDG&priipproductcode=
265,Atlas Global Infrastructure A Unhedged GBP,IE00BF6X3080,https://investorhub.financialexpress.net/Pdf/fdd/en-gb/fdd/QQU8/O/?specialunittype=ORDN&priipproductcode=
270,Aviva Inv AI Multi-asset Plus I 2,GB00B70FJQ29,https://investorhub.financialexpress.net/Pdf/fdd/en-gb/fdd/GTVP/U/?specialunittype=ORDN&priipproductcode=
275,Aviva Inv AI Multi-asset Plus V 2,GB00B7FM5934,https://investorhub.financialexpress.net/Pdf/fdd/en-gb/fdd/GTVR/U/?specialunittype=ORDN&priipproductcode=
280,Aviva Inv Higher Income Plus 2,GB0008531302,https://investorhub.financialexpress.net/Pdf/fdd/en-gb/fdd/NX19/U/?specialunittype=ORDN&priipproductcode=
285,Aviva Inv Multi-asset Core II 2,GB00BMGWH130,https://investorhub.financialexpress.net/Pdf/fdd/en-gb/fdd/WVY9/U/?specialunittype=ORDN&priipproductcode=
290,Aviva Inv Multi-asset Income 2 Acc,GB00BYZC2W42,https://investorhub.financialexpress.net/Pdf/fdd/en-gb/fdd/N3IJ/U/?specialunittype=ORDN&priipproductcode=
295,Aviva Inv Multi-Manager Flexible 2,GB00B1N95279,https://investorhub.financialexpress.net/Pdf/fdd/en-gb/fdd/W995/U/?specialunittype=ORDN&priipproductcode=
300,Aviva Inv UK Listed Equity Income 2,GB0004460803,https://investorhub.financialexpress.net/Pdf/fdd/en-gb/fdd/NA56/U/?specialunittype=ORDN&priipproductcode=
305,Aviva Investors Global High Yield Bond Rah GBP,LU0880134928,https://investorhub.financialexpress.net/Pdf/fdd/en-gb/fdd/I9JO/O/?specialunittype=CHDG&priipproductcode=
310,AXA Defensive Distribution Z Gr Inc,GB00B03KM113,https://investorhub.financialexpress.net/Pdf/fdd/en-gb/fdd/VS76/U/?specialunittype=ORDN&priipproductcode=
315,AXA Framlington American Growth Z Acc,GB00B5LXGG05,https://investorhub.financialexpress.net/Pdf/fdd/en-gb/fdd/03TF/U/?specialunittype=ORDN&priipproductcode=
320,AXA Framlington Global Technology Z Inc,GB00B5MQXC30,https://investorhub.financialexpress.net/Pdf/fdd/en-gb/fdd/03TM/U/?specialunittype=ORDN&priipproductcode=
325,AXA Framlington Japan Z Acc,GB00B7FSWP64,https://investorhub.financialexpress.net/Pdf/fdd/en-gb/fdd/11VJ/U/?specialunittype=ORDN&priipproductcode=
330,AXA Framlington UK Mid Cap Z Inc,GB00B3SYV567,https://investorhub.financialexpress.net/Pdf/fdd/en-gb/fdd/NOM8/U/?specialunittype=ORDN&priipproductcode=
335,AXA Global Distribution Z Acc,GB0008309063,https://investorhub.financialexpress.net/Pdf/fdd/en-gb/fdd/AF18/U/?specialunittype=ORDN&priipproductcode=
340,AXA Global Short Duration Bonds Z Inc,GB00BDFZQW47,https://investorhub.financialexpress.net/Pdf/fdd/en-gb/fdd/NX9Q/U/?specialunittype=ORDN&priipproductcode=
345,AXA Green Short Duration Bond Z Acc,GB00BNNDLG95,https://investorhub.financialexpress.net/Pdf/fdd/en-gb/fdd/TNRM/U/?specialunittype=ORDN&priipproductcode=
350,AXA Sterling Corporate Bond Z Gr Acc,GB00B1Z48Z43,https://investorhub.financialexpress.net/Pdf/fdd/en-gb/fdd/A3M4/U/?specialunittype=ORDN&priipproductcode=
355,AXA UK Sustainable Equity Z Inc,GB00B55S4R83,https://investorhub.financialexpress.net/Pdf/fdd/en-gb/fdd/03TS/U/?specialunittype=ORDN&priipproductcode=
360,AXA World Funds - Global Strategic Income F Hedged Cap GBP,LU0746605764,https://investorhub.financialexpress.net/Pdf/fdd/en-gb/fdd/G15A/O/?specialunittype=CHDG&priipproductcode=
365,Baillie Gifford China B Acc,GB00B39RMM81,https://investorhub.financialexpress.net/Pdf/fdd/en-gb/fdd/CSF5/U/?specialunittype=ORDN&priipproductcode=
370,Baillie Gifford Developed Asia Pacific B Inc,GB0030491632,https://investorhub.financialexpress.net/Pdf/fdd/en-gb/fdd/JOTH/U/?specialunittype=ORDN&priipproductcode=
375,Baillie Gifford European B Acc,GB0006058258,https://investorhub.financialexpress.net/Pdf/fdd/en-gb/fdd/BG90/U/?specialunittype=ORDN&priipproductcode=
380,Baillie Gifford Global Discovery B Inc,GB0006059223,https://investorhub.financialexpress.net/Pdf/fdd/en-gb/fdd/BG60/U/?specialunittype=ORDN&priipproductcode=
385,Baillie Gifford High Yield Bond B Acc,GB00B1W0GF10,https://investorhub.financialexpress.net/Pdf/fdd/en-gb/fdd/Z568/U/?specialunittype=ORDN&priipproductcode=
390,Baillie Gifford Investment Grade Bond B Inc,GB0030816481,https://investorhub.financialexpress.net/Pdf/fdd/en-gb/fdd/BE88/U/?specialunittype=ORDN&priipproductcode=
395,Baillie Gifford Japanese Smaller Companies B Acc,GB0006014921,https://investorhub.financialexpress.net/Pdf/fdd/en-gb/fdd/BG51/U/?specialunittype=ORDN&priipproductcode=
400,Baillie Gifford Managed B Inc,GB0006007909,https://investorhub.financialexpress.net/Pdf/fdd/en-gb/fdd/BG80/U/?specialunittype=ORDN&priipproductcode=
405,Baillie Gifford Pacific B Acc,GB0006063233,https://investorhub.financialexpress.net/Pdf/fdd/en-gb/fdd/BE80/U/?specialunittype=ORDN&priipproductcode=
410,Baillie Gifford Responsible Global Equity Income B Inc,GB00BFM4N494,https://investorhub.financialexpress.net/Pdf/fdd/en-gb/fdd/PIBF/U/?specialunittype=ORDN&priipproductcode=
415,Baillie Gifford Sustainable Growth B Acc,GB00BYNK7G95,https://investorhub.financialexpress.net/Pdf/fdd/en-gb/fdd/MUQZ/U/?specialunittype=ORDN&priipproductcode=
420,Baillie Gifford UK Equity Alpha B Inc,GB0005857908,https://investorhub.financialexpress.net/Pdf/fdd/en-gb/fdd/B113/U/?specialunittype=ORDN&priipproductcode=
425,Barclays Global Markets Balanced R Dis GBP,GB00B5676788,https://investorhub.financialexpress.net/Pdf/fdd/en-gb/fdd/KLK4/U/?specialunittype=ORDN&priipproductcode=
430,Barclays Global Markets Growth R Acc GBP,GB00B4ZFH287,https://investorhub.financialexpress.net/Pdf/fdd/en-gb/fdd/KLK8/U/?specialunittype=ORDN&priipproductcode=
435,Barclays Multi-Asset Cautious Income R Acc,GB00B6WYG696,https://investorhub.financialexpress.net/Pdf/fdd/en-gb/fdd/IBRE/U/?specialunittype=ORDN&priipproductcode=
440,Barclays Multi-Asset Defensive R Inc,GB00BD93Z053,https://investorhub.financialexpress.net/Pdf/fdd/en-gb/fdd/O9D2/U/?specialunittype=ORDN&priipproductcode=
445,Barclays UK Alpha R Dis GBP,GB00B51BVV49,https://investorhub.financialexpress.net/Pdf/fdd/en-gb/fdd/I1IM/U/?specialunittype=ORDN&priipproductcode=
450,Barings ASEAN Frontiers I Acc Nav GBP,IE00B3BC5W20,https://investorhub.financialexpress.net/Pdf/fdd/en-gb/fdd/MQA3/O/?specialunittype=ORDN&priipproductcode=
455,Barings Eastern Trust D Inc GBP,GB00B8N7P312,https://investorhub.financialexpress.net/Pdf/fdd/en-gb/fdd/N39W/U/?specialunittype=ORDN&priipproductcode=
460,Barings Emerging Markets Local Debt C Acc GBP,IE00BKZGL436,https://investorhub.financialexpress.net/Pdf/fdd/en-gb/fdd/P22K/O/?specialunittype=ORDN&priipproductcode=
465,Barings Europe Select Trust I Inc GBP,GB00B7NB1W76,https://investorhub.financialexpress.net/Pdf/fdd/en-gb/fdd/G60A/U/?specialunittype=ORDN&priipproductcode=
470,Barings Global Agriculture I Acc GBP,GB00B3B9VD63,https://investorhub.financialexpress.net/Pdf/fdd/en-gb/fdd/DWW9/U/?specialunittype=ORDN&priipproductcode=
475,Barings Hong Kong China I Acc NAV GBP,IE00B3YV5X70,https://investorhub.financialexpress.net/Pdf/fdd/en-gb/fdd/K9KY/O/?specialunittype=ORDN&priipproductcode=
480,BlackRock Absolute Return Bond D,GB00B618DS31,https://investorhub.financialexpress.net/Pdf/fdd/en-gb/fdd/0GIZ/U/?specialunittype=ORDN&priipproductcode=
485,BlackRock BSF ESG Fixed Income Strategies D2 Hedged GBP,LU1117534401,https://investorhub.financialexpress.net/Pdf/fdd/en-gb/fdd/FOKD/DC/?specialunittype=CHDG&priipproductcode=
490,BlackRock Consensus 60 D,GB00B86VJL67,https://investorhub.financialexpress.net/Pdf/fdd/en-gb/fdd/GFZA/U/?specialunittype=ORDN&priipproductcode=
495,BlackRock Continental European Income D Acc,GB00B3S9LG25,https://investorhub.financialexpress.net/Pdf/fdd/en-gb/fdd/NOU4/U/?specialunittype=ORDN&priipproductcode=
500,BlackRock Corporate Bond D Acc,GB00B4QC3311,https://investorhub.financialexpress.net/Pdf/fdd/en-gb/fdd/00PB/U/?specialunittype=ORDN&priipproductcode=
505,BlackRock Dynamic Diversified Growth D Inc,GB00B883P127,https://investorhub.financialexpress.net/Pdf/fdd/en-gb/fdd/I01E/U/?specialunittype=ORDN&priipproductcode=
510,BlackRock European Dynamic FD Hedged Acc,GB00BWG05X55,https://investorhub.financialexpress.net/Pdf/fdd/en-gb/fdd/MDSL/U/?specialunittype=CHDG&priipproductcode=
515,BlackRock GF China D2 Hedged GBP,LU0827876078,https://investorhub.financialexpress.net/Pdf/fdd/en-gb/fdd/F2DT/DC/?specialunittype=CHDG&priipproductcode=
520,BlackRock GF Latin American D2 GBP,LU0827883876,https://investorhub.financialexpress.net/Pdf/fdd/en-gb/fdd/F2SB/O/?specialunittype=ORDN&priipproductcode=
525,BlackRock GF World Gold D2 Hedged GBP,LU0827889212,https://investorhub.financialexpress.net/Pdf/fdd/en-gb/fdd/F2XA/DC/?specialunittype=CHDG&priipproductcode=
530,BlackRock Global Income D Acc,GB00B3L7Q242,https://investorhub.financialexpress.net/Pdf/fdd/en-gb/fdd/NOU8/U/?specialunittype=ORDN&priipproductcode=
535,BlackRock Gold & General D Inc,GB00B5ZNJ904,https://investorhub.financialexpress.net/Pdf/fdd/en-gb/fdd/FMP1/U/?specialunittype=ORDN&priipproductcode=
540,BlackRock MyMap 5 D Acc,GB00BFBFYQ25,https://investorhub.financialexpress.net/Pdf/fdd/en-gb/fdd/QCQK/U/?specialunittype=ORDN&priipproductcode=
545,BlackRock Natural Resources D Acc,GB00B6865B79,https://investorhub.financialexpress.net/Pdf/fdd/en-gb/fdd/NOV2/U/?specialunittype=ORDN&priipproductcode=
550,BlackRock SF Managed Index Portfolios - Moderate D2 Hedged GBP,LU1191063202,https://investorhub.financialexpress.net/Pdf/fdd/en-gb/fdd/FTIU/DC/?specialunittype=CHDG&priipproductcode=
555,BlackRock UK D Acc,GB00B5YKQK23,https://investorhub.financialexpress.net/Pdf/fdd/en-gb/fdd/K9K8/U/?specialunittype=ORDN&priipproductcode=
560,BlackRock UK Smaller Companies D Inc,GB00B8BS3324,https://investorhub.financialexpress.net/Pdf/fdd/en-gb/fdd/GU0N/U/?specialunittype=ORDN&priipproductcode=
565,BlackRock US Mid-Cap Value D Acc,GB00B8GMZS88,https://investorhub.financialexpress.net/Pdf/fdd/en-gb/fdd/GTZZ/U/?specialunittype=ORDN&priipproductcode=
570,BLENHEIM Diversified Fixed Income R Acc,GB00BNDQ8X45,https://investorhub.financialexpress.net/Pdf/fdd/en-gb/fdd/V3UU/U/?specialunittype=ORDN&priipproductcode=
575,BLENHEIM Ethical Opportunities R Inc,GB00BNDQ9J75,https://investorhub.financialexpress.net/Pdf/fdd/en-gb/fdd/DXUN/U/?specialunittype=ORDN&priipproductcode=
580,BlueBay Global High Yield ESG Bond C Hedged Dis GBP,LU2233263826,https://investorhub.financialexpress.net/Pdf/fdd/en-gb/fdd/W3KJ/O/?specialunittype=CHDG&priipproductcode=
585,BNY Mellon Brazil Equity W Acc GBP,IE00B90P3080,https://investorhub.financialexpress.net/Pdf/fdd/en-gb/fdd/I3LH/O/?specialunittype=ORDN&priipproductcode=
590,BNY Mellon Emerging Markets Debt Local Currency C Acc GBP,IE00B2Q4XS80,https://investorhub.financialexpress.net/Pdf/fdd/en-gb/fdd/FTF3/O/?specialunittype=ORDN&priipproductcode=
595,BNY Mellon FutureLegacy 3 Institutional W Acc GBP,GB00BQH86S85,https://investorhub.financialexpress.net/Pdf/fdd/en-gb/fdd/S9PW/U/?specialunittype=ORDN&priipproductcode=
600,BNY Mellon FutureLegacy 5 Institutional W Dis GBP,GB00BQH88T33,https://investorhub.financialexpress.net/Pdf/fdd/en-gb/fdd/CZCY/U/?specialunittype=ORDN&priipproductcode=
605,BNY Mellon Global Absolute Return Inst W Acc,GB00B83VQG35,https://investorhub.financialexpress.net/Pdf/fdd/en-gb/fdd/I8XZ/U/?specialunittype=ORDN&priipproductcode=
610,BNY Mellon Global Dynamic Bond Institutional W Acc GBP,,https://investorhub.financialexpress.net/Pdf/fdd/en-gb/fdd/GP1Q/U/?specialunittype=ORDN&priipproductcode=
615,BNY Mellon Global Equity Income(Responsible) Inst W Acc,GB00BJ066Z75,https://investorhub.financialexpress.net/Pdf/fdd/en-gb/fdd/QIMY/U/?specialunittype=ORDN&priipproductcode=
620,BNY Mellon Global High Yield Bond Inst W Inc,GB00B8BX3V56,https://investorhub.financialexpress.net/Pdf/fdd/en-gb/fdd/GP1R/U/?specialunittype=ORDN&priipproductcode=
625,BNY Mellon Global Leaders W Acc GBP,IE00BYQQK106,https://investorhub.financialexpress.net/Pdf/fdd/en-gb/fdd/NOAW/O/?specialunittype=ORDN&priipproductcode=
630,BNY Mellon Global Short Dated High Yield Bond W Hedged Acc GBP,IE00BD5CVF34,https://investorhub.financialexpress.net/Pdf/fdd/en-gb/fdd/C2OI/O/?specialunittype=CHDG&priipproductcode=
635,BNY Mellon International Bond B Acc GBP,GB00B7B44R49,https://investorhub.financialexpress.net/Pdf/fdd/en-gb/fdd/GTIE/U/?specialunittype=ORDN&priipproductcode=
640,BNY Mellon Multi-Asset Balanced B Inc,GB00B8K7QM04,https://investorhub.financialexpress.net/Pdf/fdd/en-gb/fdd/GW0O/U/?specialunittype=ORDN&priipproductcode=
645,BNY Mellon Multi-Asset Global Balanced Inst W Acc,GB00BD8YW204,https://investorhub.financialexpress.net/Pdf/fdd/en-gb/fdd/NZI1/U/?specialunittype=ORDN&priipproductcode=
650,BNY Mellon Multi-Asset Income Sterling Acc,GB00BP851P32,https://investorhub.financialexpress.net/Pdf/fdd/en-gb/fdd/N2QI/U/?specialunittype=ORDN&priipproductcode=
655,BNY Mellon Real Return B Inc,GB00B7T1DJ29,https://investorhub.financialexpress.net/Pdf/fdd/en-gb/fdd/GVCG/U/?specialunittype=ORDN&priipproductcode=
660,BNY Mellon UK Equity Inst W Acc,GB00B6X4W596,https://investorhub.financialexpress.net/Pdf/fdd/en-gb/fdd/GPQM/U/?specialunittype=ORDN&priipproductcode=
665,BNY Mellon UK Opportunities (Responsible) Inst W Inc,GB00B7RLX837,https://investorhub.financialexpress.net/Pdf/fdd/en-gb/fdd/GPQN/U/?specialunittype=ORDN&priipproductcode=
670,Brown Advisory Global Leaders BH Acc GBP,IE00BVVHP902,https://investorhub.financialexpress.net/Pdf/fdd/en-gb/fdd/QZCU/O/?specialunittype=CHDG&priipproductcode=
675,Brown Advisory US Smaller Companies B GBP,IE00B0PVDH59,https://investorhub.financialexpress.net/Pdf/fdd/en-gb/fdd/DMY2/O/?specialunittype=ORDN&priipproductcode=
680,Calamos Global Convertible Z Acc GBP,IE00BKRVJH58,https://investorhub.financialexpress.net/Pdf/fdd/en-gb/fdd/KP1G/DC/?specialunittype=ORDN&priipproductcode=
685,Capital Group European Core Equity Fund (LUX) Z GBP,LU0817813115,https://investorhub.financialexpress.net/Pdf/fdd/en-gb/fdd/F8KG/O/?specialunittype=ORDN&priipproductcode=
690,Capital Group Global Equity Fund (LUX) Z GBP,LU0817818429,https://investorhub.financialexpress.net/Pdf/fdd/en-gb/fdd/F8KS/O/?specialunittype=ORDN&priipproductcode=
695,Capital Group Global High Income Opportunities (LUX) Zh GBP,LU0817818189,https://investorhub.financialexpress.net/Pdf/fdd/en-gb/fdd/GZPX/O/?specialunittype=CHDG&priipproductcode=
700,Capital Group Japan Equity Fund (LUX) Z GBP,LU0817826521,https://investorhub.financialexpress.net/Pdf/fdd/en-gb/fdd/F8IS/O/?specialunittype=ORDN&priipproductcode=
705,Capital Group New Perspective Fund (LUX) Zh GBP,LU1295556960,https://investorhub.financialexpress.net/Pdf/fdd/en-gb/fdd/E07T/O/?specialunittype=CHDG&priipproductcode=
710,Capital Group World Dividend Growers (LUX) Z GBP,LU0939078415,https://investorhub.financialexpress.net/Pdf/fdd/en-gb/fdd/FB3E/O/?specialunittype=ORDN&priipproductcode=
715,Carmignac Portfolio Asia Discovery FW GBP Acc,LU0992630086,https://investorhub.financialexpress.net/Pdf/fdd/en-gb/fdd/JWKL/O/?specialunittype=ORDN&priipproductcode=
720,Carmignac Portfolio Patrimoine FH GBP Acc Hdg,LU0992627967,https://investorhub.financialexpress.net/Pdf/fdd/en-gb/fdd/JWLW/O/?specialunittype=CHDG&priipproductcode=
725,CG AJ Bell Balanced I Acc,GB00BYW8RX12,https://investorhub.financialexpress.net/Pdf/fdd/en-gb/fdd/NT3E/U/?specialunittype=ORDN&priipproductcode=
730,CG Morningstar Multi Asset 40 A,GB00BMC71091,https://investorhub.financialexpress.net/Pdf/fdd/en-gb/fdd/HLGV/U/?specialunittype=ORDN&priipproductcode=
735,Cohen & Steers Diversified Real Assets F Acc GBP,LU1821812770,https://investorhub.financialexpress.net/Pdf/fdd/en-gb/fdd/PGBA/O/?specialunittype=ORDN&priipproductcode=
740,Comgest Growth Europe ex UK SU Dis GBP,IE00BK5X4B26,https://investorhub.financialexpress.net/Pdf/fdd/en-gb/fdd/QYU0/O/?specialunittype=ORDN&priipproductcode=
745,CT (Lux) Credit Opportunities 8GH Acc GBP,LU1829332284,https://investorhub.financialexpress.net/Pdf/fdd/en-gb/fdd/P4GG/DC/?specialunittype=CHDG&priipproductcode=
750,CT (Lux) European Social Bond ZGH,LU1589837530,https://investorhub.financialexpress.net/Pdf/fdd/en-gb/fdd/NUKR/DC/?specialunittype=CHDG&priipproductcode=
755,CT (Lux) Pan European Smaller Companies 3GP Inc GBP,LU1829331120,https://investorhub.financialexpress.net/Pdf/fdd/en-gb/fdd/P4GR/DC/?specialunittype=ORDN&priipproductcode=
760,CT American Select ZNI GBP,GB00B8BC1961,https://investorhub.financialexpress.net/Pdf/fdd/en-gb/fdd/G7CG/U/?specialunittype=ORDN&priipproductcode=
765,CT Asia Pacific ZNA GBP,GB00B83BWC19,https://investorhub.financialexpress.net/Pdf/fdd/en-gb/fdd/G7CT/U/?specialunittype=ORDN&priipproductcode=
770,CT Emerging Market Bond ZNI GBP,GB00B817DW83,https://investorhub.financialexpress.net/Pdf/fdd/en-gb/fdd/G7CI/U/?specialunittype=ORDN&priipproductcode=
775,CT European Smaller Companies ZNA GBP,GB00B84CYY92,https://investorhub.financialexpress.net/Pdf/fdd/en-gb/fdd/I8DB/U/?specialunittype=ORDN&priipproductcode=
780,CT FTSE All-Share Tracker 2 Inc,GB0008464645,https://investorhub.financialexpress.net/Pdf/fdd/en-gb/fdd/KL89/U/?specialunittype=ORDN&priipproductcode=
785,CT Global Extended Alpha INA GBP,GB00B3B0F606,https://investorhub.financialexpress.net/Pdf/fdd/en-gb/fdd/CCI0/U/?specialunittype=ORDN&priipproductcode=
790,CT Global Select ZNA GBP,GB00B8C2TM45,https://investorhub.financialexpress.net/Pdf/fdd/en-gb/fdd/G7CN/U/?specialunittype=ORDN&priipproductcode=
795,CT High Yield Bond ZNI GBP,GB00B7SGDT88,https://investorhub.financialexpress.net/Pdf/fdd/en-gb/fdd/G7CP/U/?specialunittype=ORDN&priipproductcode=
